show_id,type,title,director,cast,country,date_added,release_year,rating,duration,listed_in,description
s6754,Movie,Final Destination,James Wong,"Devon Sawa, Ali Larter, Kerr Smith, Kristen Cloke, Seann William Scott, Tony Todd, Daniel Roebuck, Chad Donella, Roger Guenveur Smith, Amanda Detmer",United States,"January 1, 2020",2000,R,98 min,"Cult Movies, Horror Movies, Thrillers","After narrowly avoiding a fatal plane explosion, a group of seemingly lucky teen classmates finds that Death is not so easily cheated."
s6755,Movie,Final Destination 2,David R. Ellis,"Ali Larter, A.J. Cook, Michael Landes, Terrence 'T.C.' Carson, Jonathan Cherry, Keegan Connor Tracy, Sarah Carter, Lynda Boyd, David Paetkau, Justina Machado","United States, Canada","January 1, 2020",2003,R,90 min,"Horror Movies, Thrillers","On a road trip with friends, Kimberly has a premonition that saves everyone from a freak accident. More terrifying visions prompt her to seek help."
s6756,Movie,Final Destination 3,James Wong,"Mary Elizabeth Winstead, Ryan Merriman, Kris Lemche, Alexz Johnson, Sam Easton, Jesse Moss, Gina Holden, Texas Battle, Chelan Simmons, Crystal Lowe, Amanda Crew","United States, Germany","January 1, 2020",2006,R,93 min,Horror Movies,"When a girl prevents her premonition of a deadly roller-coaster mishap from coming true, the survivors must face the consequences of cheating death."
s6757,Movie,Fire at Sea,Gianfranco Rosi,"Samuele Caruana, Giuseppe Fragapane","Italy, France","March 21, 2017",2016,TV-14,114 min,"Documentaries, International Movies","Heartbreak, hope and nostalgia collide in this complex portrait of Lampedusa, a Mediterranean island where thousands of migrants land each year."
s6758,Movie,Fireflies,Sabal Singh Shekawat,"Rahul Khanna, Arjun Mathur, Shivani Ghai, Monica Dogra, Aadya Bedi",India,"April 24, 2019",2013,TV-MA,99 min,"Dramas, Independent Movies, International Movies","Grappling with love and loss in their respective lives, two estranged brothers must confront their traumatic, unresolved past when they cross paths."
s6759,Movie,First Impression,Arthur Muhammad,"Lamman Rucker, Lisa Arrindell Anderson, Elise Neal, Kendrick Cross",United States,"May 17, 2019",2018,TV-14,96 min,"Comedies, Romantic Movies","Unaware they’ve matched online, a struggling writer embellishes his lifestyle to impress a successful exec with whom he sparks an unexpected romance."
s6760,Movie,First Kill,Steven C. Miller,"Hayden Christensen, Bruce Willis, Gethin Anthony, Megan Leonard, Tyler Jon Olson, Shea Buckner, William DeMeo, Magi Avila, Ty Shelton, Christine Dye","United Kingdom, Canada, United States","September 1, 2019",2017,R,102 min,Action & Adventure,"A stock broker brings his young son back to the town where he grew up for a hunting trip, but things take a dangerous turn when they witness a crime."
s6761,Movie,FirstBorn,Nirpal Bhogal,"Antonia Thomas, Luke Norris, Thea Petrie, Eileen Davies, Jonathan Hyde",United Kingdom,"March 31, 2017",2016,TV-MA,90 min,"Horror Movies, International Movies",A young couple fights supernatural foes in an attempt to save their daughter from the dark and mysterious forces that follow her every move.
s6762,Movie,Fishpeople,Keith Malloy,,,"April 1, 2018",2017,TV-14,49 min,"Documentaries, Sports Movies","In this exploration of the life-changing power of the ocean, six people from very different backgrounds find purpose and meaning in the sea."
s6763,Movie,Fishtail,Andrew Renzi,Harry Dean Stanton,United States,"October 1, 2018",2015,NR,61 min,Documentaries,Harry Dean Stanton narrates this documentary that follows two modern-day cowboys as they welcome new calves at Montana's Fishtail Basin Ranch.
s6765,Movie,Fittest in Dubai,Gerry Blaksley,,United Arab Emirates,"April 15, 2020",2019,TV-14,60 min,"Documentaries, International Movies, Sports Movies",Top athletes from around the globe test their fitness in a four-day competition at the first-ever CrossFit Sanctional event. Let the games begin.
s6766,Movie,Five Elements Ninjas,Cheh Chang,"Tien-chi Cheng, Tien Hsiang Lung, Meng Lo, Michael Chan Wai-Man, Pei Hsi Chen, Li Wang, Ke Chu",Hong Kong,"September 17, 2019",1982,R,104 min,"Action & Adventure, International Movies","When five ninjas whose fighting styles are based on natural elements unleash their fury on a rival school, a lone survivor vows deadly revenge."
s6768,Movie,Flash of Genius,Marc Abraham,"Greg Kinnear, Lauren Graham, Dermot Mulroney, Alan Alda, Bill Smitrovich, Mitch Pileggi, Daniel Roebuck, Tim Kelleher, Aaron Abrams, Chuck Shamata, Andrew Gillies","Canada, United States","January 16, 2017",2008,PG-13,119 min,Dramas,A college professor goes up against the giants of the auto industry when they fail to give him credit for inventing intermittent windshield wipers.
s6769,Movie,Flimflam,Khaled Marei,"Ahmed Helmy, Donia Samir Ghanim, Sabrine, Bayyumi Fuad, Jamila Adel Awad, Bea, Yasser El Tobgy, Enaam Salousa",Egypt,"June 13, 2019",2016,TV-14,102 min,"Comedies, International Movies","Nosy family in tow, a fun-loving bachelor goes on a romantic getaway, but he ends up pretending to be married to a complete stranger to avoid trouble."
s6770,Movie,Flock of Four,Gregory Caruso,"Braeden Lemasters, Isaac Jay, Uriah Shelton, Dylan Riley Snyder, Coco Jones, Shane Harper, Nadji Jeter, Connor Paolo, Gatlin Green, Reg E. Cathey",United States,"August 1, 2018",2018,TV-MA,83 min,"Dramas, Independent Movies, Music & Musicals","One night in 1959, four young musicians venture from Pasadena to South-Central Los Angeles in the hopes of hearing a living jazz legend play."
s6772,Movie,Flying Guillotine 2,"Kang Cheng, Shan Hua","Feng Ku, Chung Wang, Szu Shih, Lung Ti, Lo Lieh, Szu-Chia Chen",Hong Kong,"July 31, 2018",1978,TV-MA,88 min,"Action & Adventure, International Movies","The emperor's reign of terror expands. Heroic outlaw Ma Teng joins a squad of female rebels, whose leader is torn between family loyalties."
s6773,Movie,Follow Me,Asri Bendacha,Asri Bendacha,"United Arab Emirates, United States, United Kingdom","November 16, 2018",2017,TV-MA,86 min,"Documentaries, International Movies","Aspiring to be an internet celebrity and make big bucks, a filmmaker travels the world to learn the tricks of the trade from social media influencers."
s6776,Movie,Footprints: The Path of Your Life,Juan Manuel Cotelo,,Spain,"June 30, 2017",2015,PG,90 min,"Documentaries, Faith & Spirituality, International Movies","This documentary follows 10 men who agree to walk the Camino de Santiago, a 500-mile, 40-day trek that will challenge their strength and faith."
s6777,Movie,For Colored Girls,Tyler Perry,"Kimberly Elise, Janet Jackson, Loretta Devine, Thandie Newton, Anika Noni Rose, Kerry Washington, Tessa Thompson, Phylicia Rashad, Whoopi Goldberg, Omari Hardwick, Macy Gray, Michael Ealy, Richard Lawson, Hill Harper, Khalil Kain",United States,"May 1, 2020",2010,R,134 min,Dramas,This adaptation of Ntozake Shange's play consists of a series of poetic vignettes that explore the lives of modern African American women.
s6778,Movie,For Grace,"Mark Helenowski, Kevin Pang",,United States,"March 2, 2016",2015,TV-PG,92 min,Documentaries,"As chef Curtis Duffy oversees every aspect of opening his own restaurant, Grace, he recalls his turbulent childhood and difficult adult relationships."
s6779,Movie,For Greater Glory,Dean Wright,"Rubén Blades, Bruce Greenwood, Bruce McGill, Peter O'Toole, Andy Garcia, Nestor Carbonell, Eduardo Verástegui, Catalina Sandino Moreno, Eva Longoria, Santiago Cabrera, Adrian Alonso, Oscar Isaac, Mauricio Kuri",Mexico,"August 2, 2019",2012,R,145 min,"Dramas, International Movies","When a vicious war against Catholics is waged in Mexico in the 1920s, a retired general joins the militia fighting to preserve religious freedom."
s6780,Movie,For Love or Money,Mark Murphy,"Robert Kazinsky, Samantha Barks, Ed Speleers, Tony Way, Rachel Hurd-Wood, Ivan Kaye, Anna Chancellor, David Hargreaves, Tanya Reynolds",United Kingdom,"August 16, 2019",2019,TV-MA,95 min,Comedies,"When a goofy but likable millionaire discovers his fiancée’s plan to steal his wealth, he devises an unromantic scheme to make her life a living hell."
s6781,Movie,For the Birds,Richard Miron,Kathy Murphy,United States,"September 1, 2019",2018,TV-MA,93 min,Documentaries,"A woman with a passion for fowl keeps a menagerie of birds that draws the ire of neighbors, animal rights advocates and even her own family."
s6782,Movie,For the Love of Benji,Joe Camp,"Patsy Garrett, Cynthia Smith, Allen Fiuzat, Ed Nelson, Art Vasil, Peter Bowles, Bridget Armstrong, Mihalis Lambrinos, Dean Goss, Tony Alatis",United States,"March 6, 2018",1977,G,84 min,Children & Family Movies,"Benji and his owner get separated in Greece. On his quest to find them, he's targeted by various bad guys who want to get their hands on him."
s6784,Movie,Forbidden Games: The Justin Fashanu Story,"Jon Carey, Adam Darke","Justin Fashanu, John Fashanu",United Kingdom,"December 1, 2017",2017,TV-14,81 min,"Documentaries, International Movies, LGBTQ Movies","This documentary chronicles the tragic, true story of Justin Fashanu, the first – and only – openly gay man to have played professional soccer."
s6785,Movie,Forbidden Planet,Fred M. Wilcox,"Leslie Nielsen, Walter Pidgeon, Anne Francis, Jack Kelly, Warren Stevens, James Drury, Earl Holliman",United States,"November 1, 2019",1956,G,98 min,"Action & Adventure, Classic Movies, Sci-Fi & Fantasy","A pulp-fiction sci-fi classic, Forbidden Planet stars Leslie Nielsen as a heroic starship captain who finds the paradise planet Altair-IV."
s6787,Movie,Forever Chape,Luis Ara,,Brazil,"August 2, 2018",2018,TV-MA,74 min,"Documentaries, International Movies, Sports Movies","In the wake of the plane crash that claimed the lives of 71 people, the Brazilian soccer club Chapecoense seeks to rebuild the team that made history."
s6788,Movie,Forever Pure,Maya Zinshtein,,"United Kingdom, Israel, Russia","May 29, 2017",2016,TV-MA,87 min,"Documentaries, International Movies, Sports Movies",The furor over the addition of two Muslim players to the Beitar Jerusalem soccer club underscores the role of institutionalized racism in Israel.
s6790,Movie,Forks Over Knives,Lee Fulkerson,,United States,"October 3, 2019",2011,PG,96 min,Documentaries,"According to the research of two food scientists, the popularity of processed foods has led to epidemic rates of obesity, diabetes and other diseases."
s6791,Movie,Four Christmases,Seth Gordon,"Vince Vaughn, Reese Witherspoon, Robert Duvall, Sissy Spacek, Jon Voight, Jon Favreau, Mary Steenburgen, Dwight Yoakam, Tim McGraw, Kristin Chenoweth","Germany, United States","January 1, 2021",2008,PG-13,88 min,"Comedies, Romantic Movies",A dating couple is forced to spend their first Christmas together visiting each of their four divorced parents – in a single day.
s6793,Movie,Four Weddings and a Funeral,Mike Newell,"Hugh Grant, Andie MacDowell, James Fleet, Simon Callow, John Hannah, Kristin Scott Thomas, David Bower, Charlotte Coleman, David Haig, Rowan Atkinson, Sophie Thompson, Anna Chancellor, Corin Redgrave",United Kingdom,"August 1, 2019",1994,R,118 min,"Classic Movies, Comedies, International Movies","A commitment-phobic Brit tries to reconnect with an alluring American who's about to make a seemingly awful mistake by marrying a wealthy, boring man."
s6794,Movie,Fracture,Gregory Hoblit,"Anthony Hopkins, Ryan Gosling, David Strathairn, Rosamund Pike, Embeth Davidtz, Billy Burke, Cliff Curtis, Fiona Shaw, Bob Gunton, Josh Stamberg","United States, Germany","April 1, 2019",2007,R,113 min,"Dramas, Thrillers","Ted Crawford, who allegedly attempted to murder his wife, is now locked in a battle of wits with a young assistant district attorney."
s6795,Movie,Frances Ha,Noah Baumbach,"Greta Gerwig, Mickey Sumner, Charlotte d'Amboise, Adam Driver, Hannah Dunne, Michael Esper, Grace Gummer, Patrick Heusinger, Josh Hamilton, Cindy Katz, Maya Kazan, Justine Lupe, Britta Phillips, Juliet Rylance, Dean Wareham, Michael Zegen","United States, Brazil","October 1, 2017",2012,R,86 min,"Comedies, Dramas, Independent Movies","Determined to make it as a modern dancer in New York, a young woman pursues her unlikely goal with more enthusiasm than natural talent."
s6797,Movie,Freak Show,Trudie Styler,"Alex Lawther, Abigail Breslin, AnnaSophia Robb, Ian Nelson, Celia Weston, Laverne Cox, Bette Midler, Willa Fitzgerald, Larry Pine, John McEnroe, Mickey Sumner, Daniel Bellomy, Wally Dunn, Marceline Hugot",United States,"August 13, 2020",2018,TV-MA,91 min,"Comedies, Dramas, Independent Movies","Forced to attend a new high school, a glamorous teen navigates hostile territory before taking a stand by running for homecoming queen."
s6798,Movie,Fred Claus,David Dobkin,"Vince Vaughn, Paul Giamatti, John Michael Higgins, Miranda Richardson, Rachel Weisz, Kathy Bates, Trevor Peacock, Ludacris, Elizabeth Banks",United States,"January 1, 2021",2007,PG,115 min,"Children & Family Movies, Comedies",The holiday season is ruined for Santa Claus when his cranky older brother – a repo man with a sizable rap sheet – visits him at the North Pole.
s6799,Movie,Free Willy,Simon Wincer,"Jason James Richter, Lori Petty, Jayne Atkinson, August Schellenberg, Michael Madsen, Michael Ironside, Richard Riehle, Mykelti Williamson, Michael Bacall, Danielle Harris","United States, France, Mexico","January 1, 2020",1993,PG,112 min,"Children & Family Movies, Dramas","Ordered to clean up the graffiti he painted at a marine theme park, a troubled young boy unexpectedly bonds with a killer whale on exhibit."
s6800,Movie,Freeway: Crack in the System,Marc Levin,Freeway Rick Ross,"United States, Nicaragua","December 15, 2017",2015,R,103 min,Documentaries,"Take in the true account of drug kingpin ""Freeway"" Rick Ross's empire and how the CIA helped him fuel America's  devastating crack cocaine epidemic."
s6801,Movie,Freezer's Campaign,Sameh Abdulaziz,"Bayyumi Fuad, Chico, Hesham Maged, Ahmed Fathy, Nesreen Ameen, Dareen Haddad, Bushra, Samy Maghawry",Egypt,"June 6, 2019",2016,TV-MA,116 min,"Comedies, International Movies","When climate change makes Egypt freeze over, intelligence officers pose as a film crew on location to seek a device that can eliminate the frost."
s6802,Movie,French Dirty,"Wade Allain-Marcus, Jesse Allain-Marcus","Wade Allain-Marcus, Arjun Gupta, Melina Lizette, Elsa Biedermann, Katie Blake, Santana Dempsey",United States,"February 4, 2016",2015,TV-MA,72 min,"Dramas, Independent Movies","An aimless, unemployed millennial hangs out with his pals and resists growing up, until an affair with his best friend's girl forces him to change."
s6803,Movie,Freshman Year,Jude Okwudiafor Johnson,"Diallo Thompson, Natalia Dominguez, Benjamin A. Onyango, Gregory Alan Williams, Desalene Jones, Wynton Odd, Ed Gonzalez Moreno, Natasha Dee Davis, Cameron Schaefer, Joshua Flores-Q",United States,"March 3, 2020",2019,TV-PG,104 min,"Dramas, Faith & Spirituality",A devout preacher's son leaves his protective home to begin college and meets a self-reliant student who will test his faith and his heart.
s6805,Movie,Friday the 13th,Marcus Nispel,"Jared Padalecki, Danielle Panabaker, Amanda Righetti, Travis Van Winkle, Aaron Yoo, Derek Mears, Jonathan Sadowski, Julianna Guill, Ben Feldman, Arlen Escarpeta, Ryan Hansen",United States,"January 1, 2020",2009,R,97 min,Horror Movies,"A group of teenage camp counselors raises the ire of Jason Voorhees, a masked, homicidal maniac, in this remake of the classic slasher flick."
s6806,Movie,Friend Request,Simon Verhoeven,"Alycia Debnam-Carey, William Moseley, Connor Paolo, Brit Morgan, Brooke Markham, Sean Marquette, Liesl Ahlers, Shashawnee Hall, Susan Danford",Germany,"April 18, 2018",2016,R,92 min,"Horror Movies, International Movies",A popular college student's love of social media becomes her biggest regret when a mysterious account marks each of her friends for a grisly demise.
s6808,Movie,From Japan to Egypt,Mahmoud Karim,"Ahmed Eid, Saki Tsukamoto, Nada Moussa, Mohammed Tharwat",Egypt,"June 6, 2019",2017,TV-14,93 min,"Children & Family Movies, Comedies, Dramas","After his wife relocates to her home country of Japan, an Egyptian man – and father of two rambunctious kids – tries to win her back."
s6809,Movie,From Paris with Love,Pierre Morel,"John Travolta, Jonathan Rhys Meyers, Kasia Smutniak, Richard Durden, Bing Yin, Amber Rose Revah, Eric Godon, François Bredon, Chems Dahmani, Sami Darr, Didier Constant","France, United Kingdom, United States","September 8, 2020",2010,R,93 min,"Action & Adventure, International Movies",A low-level intelligence agent gets pulled into action and espionage above his pay grade when he's ordered to assist a trigger-happy senior agent.
s6810,Movie,Froning: The Fittest Man in History,Heber Cannon,Rich Froning,United States,"July 15, 2018",2016,PG,99 min,"Documentaries, International Movies, Sports Movies",Follow the grueling training regimen of Rich Froning Jr. as he sets his sights on winning an unprecedented fourth CrossFit Games title.
s6812,Movie,Frozen Planet: On Thin Ice,,David Attenborough,"United Kingdom, United States, Spain, Germany, Greece, Canada","January 28, 2016",2011,TV-PG,47 min,Movies,David Attenborough journeys to both polar regions to investigate what rising temperatures will mean for the people and wildlife that live there.
s6813,Movie,Frozen Planet: The Epic Journey,,David Attenborough,"United Kingdom, United States, Spain, Germany, Greece, Canada","January 28, 2016",2011,TV-PG,52 min,Movies,"Collecting highlights from the epic documentary series that explores the entire polar year and the inhabitants, from the north to the south."
s6814,Movie,Frozen River,Courtney Hunt,"Melissa Leo, Misty Upham, Charlie McDermott, Michael O'Keefe, Mark Boone Junior, James Reilly, Jay Klaitz, John Canoe, Dylan Carusona, Michael Sky",United States,"July 1, 2019",2008,R,97 min,"Dramas, Independent Movies","On a Mohawk reservation on the Canadian border, Ray Eddy teams with a widowed tribe member to smuggle illegal immigrants into the United States."
s6815,Movie,Full Out,Sean Cisterna,"Jennifer Beals, Ana Golja, Art Hindle, Jake Epstein, Ramona Milano, Trevor Tordjman, Lamar Johnson, Asha Bromfield, Sarah Fisher","Canada, United States","September 1, 2016",2015,TV-PG,88 min,"Children & Family Movies, Dramas, Sports Movies","After a debilitating accident ends her Olympic dreams, gymnast Ariana Berlin finds recovery and hope in the world of hip-hop and college athletics."
s6816,Movie,Functional Fitness,Bob Rose,,United States,"January 1, 2018",2016,TV-MA,106 min,Documentaries,"This documentary explores the challenging, transformative world of high-intensity fitness programs through the eyes of the people who've embraced them."
s6817,Movie,Furie,Le Van Kiet,"Ngo Thanh Van, Phan Thanh Nhien, Mai Cat Vi, Thanh Hoa, Pham Anh Khoa",Vietnam,"September 25, 2019",2019,TV-MA,97 min,"Action & Adventure, Dramas, International Movies","When traffickers kidnap her daughter from their village, vengeful Hai Phuong returns to Saigon – and her outlaw roots – to take down the abductors."
s6818,Movie,Furthest Witness,Adam Del Giudice,"Aaron Stanford, Teri Reeves, Sean Patrick Flanery, Forrest Fyre, Steven Michael Quezada, Paul Blott, Travis Hammer, Ryan Begay, Jermaine Washington, Vincent McDaniel","United States, United Kingdom","April 24, 2019",2017,TV-MA,88 min,"Dramas, Thrillers","Kyle helps people disappear, but when a crazed killer starts hunting down his latest client, he has to decide what he's willing to do to keep her safe."
s6819,Movie,G-Force,Hoyt Yeatman,"Bill Nighy, Will Arnett, Zach Galifianakis, Kelli Garner, Tyler Patrick Jones, Piper Mackenzie Harris, Gabriel Casseus, Jack Conley, Niecy Nash, Justin Mentell, Nicolas Cage, Sam Rockwell, Jon Favreau, Penélope Cruz, Steve Buscemi, Tracy Morgan",United States,"March 15, 2019",2009,PG,88 min,"Children & Family Movies, Comedies","When a billionaire sets out to take over the world, only one special forces unit can handle the job – a squad of highly trained guinea pigs."
s6820,Movie,Gabriel and the Mountain,Fellipe Barbosa,"João Pedro Zappa, Caroline Abras, Alex Alembe, Leonard Siampala, Tony B. Lesika, John Goodluck, Rashidi Athuman, Toney Montana, George Ngandu, Rhosinah Sekeleti, Luke Mpata, Lewis Gadson, Manuela Pacq","Brazil, France","November 9, 2018",2017,TV-MA,132 min,"Dramas, Independent Movies, International Movies","In a drama based on a true story, Brazilian backpacker Gabriel Buchmann spends his gap year exploring Africa. Why does he die in the Malawi mountains?"
s6822,Movie,Gagarin: First in Space,Pavel Parkhomenko,"Yaroslav Zhalnin, Mikhail Filippov, Olga Ivanova, Vadim Michman, Vladimir Steklov, Viktor Proskurin, Nadezhda Markina, Daniil Vorobyov",Russia,"September 15, 2017",2013,TV-14,108 min,"Dramas, International Movies",This biopic of Russian cosmonaut Yuri Gagarin follows his rise from childhood poverty to his selection and training for the 1961 Vostok mission.
s6824,Movie,Galih dan Ratna,Lucky Kuswandi,"Refal Hady, Sheryl Sheinafia, Ayu Dyah Pasha, Joko Anwar, Hengky Tarnando, Marissa Anita, Sari Koeswoyo",Indonesia,"September 15, 2018",2017,TV-PG,111 min,"Dramas, International Movies, Romantic Movies",Sparks fly between the new girl at school and the misfit with a passion for music. Yet the world threatens to put a stop to their innocent love song.
s6827,Movie,Gangs of New York,Martin Scorsese,"Leonardo DiCaprio, Daniel Day-Lewis, Cameron Diaz, Jim Broadbent, John C. Reilly, Henry Thomas, Liam Neeson, Brendan Gleeson, Gary Lewis, Stephen Graham","United States, Italy","August 20, 2019",2002,R,167 min,Dramas,"In the crime-ridden slums of New York in the 1860s, vengeful orphan Amsterdam Vallon joins the cutthroat gang of his father's killer, Bill the Butcher."
s6829,Movie,Garuda Di Dadaku,Ifa Isfansyah,"Emir Mahira, Maudy Koesnaedi, Ikranagara, Aldo Tansani, Marsha Aruan, Ari Sihasale",Indonesia,"October 9, 2018",2009,TV-PG,96 min,"Children & Family Movies, Dramas, Sports Movies","A determined boy will do anything to become a great soccer player, despite the wishes of his grandfather."
s6830,Movie,Garuda in My Heart 2,Rudy Soedjarwo,"Emir Mahira, Aldo Tansani, Maudy Koesnaedi, Ramzi, Rio Dewanto, Monica Sayangbati, Rendy Khrisna",Indonesia,"November 30, 2018",2011,TV-PG,95 min,"Children & Family Movies, Dramas, Sports Movies",A young soccer player sets out to prove he can lead his team to a championship – but being a winner is about more than just talent.
s6831,Movie,Gehenna: Where Death Lives,Hiroshi Katagiri,"Eva Swan, Simon Phillips, Justin Gordon, Doug Jones, Lance Henriksen, Matthew Edward Hegstrom, Patrick Gorman, Sean Sprawling, Masashi Odate","Japan, United States","December 10, 2018",2016,TV-MA,107 min,"Horror Movies, Thrillers",Developers looking for a location to build a resort on Saipan stumble into a subterranean bunker from WWII where an evil force lies in wait.
s6832,Movie,Gelo,Manbhavan Singh,"Jaspinder Cheema, Pavan Malhotra, Gurjit Singh, Dilawar Sidhu, Aditya Sharma, Raj Dhaliwal",India,"December 15, 2017",2016,TV-MA,118 min,"Dramas, International Movies",A Punjabi woman who works on a farm must endure the difficulties of living in an oppressive class-based society and a dysfunctional community.
s6833,Movie,Gemini,P.K. Baaburaaj,"Esther Anil, Sijoy Varghese, Renji Panicker, Thanusree Ghosh, Sasi Kalinga, Kishore Sathya, Sethu Lakshmi, Rosin Jolly",India,"July 1, 2018",2018,TV-PG,130 min,Dramas,"Despite growing up with traits that set her apart from her peers, a young adopted girl discovers her gift when she takes an interest in spelling bees."
s6834,Movie,Gender Revolution: A Journey with Katie Couric,,Katie Couric,United States,"February 1, 2018",2017,TV-PG,90 min,"Documentaries, LGBTQ Movies","Katie Couric explores our evolving understanding of gender identity, speaking with transgender and intersex individuals about their experiences."
s6838,Movie,George of the Jungle 2,David Grossman,"Christopher Showerman, Julie Benz, Angus T. Jones, Thomas Haden Church, Christina Pickles, John Cleese, Michael Clarke Duncan, John Kassir, Kevin Greutert, Keith Scott","United States, Australia","December 20, 2016",2003,PG,87 min,"Children & Family Movies, Comedies","Now married and raising a son, clumsy ape-man George finds his jungle kingdom in peril as Really Mean Lion challenges him for the throne."
s6840,Movie,Get Him to the Greek,Nicholas Stoller,"Jonah Hill, Russell Brand, Elisabeth Moss, Rose Byrne, Colm Meaney, Sean ""P. Diddy"" Combs, Aziz Ansari, Carla Gallo, Nick Kroll, Kristen Schaal",United States,"January 16, 2020",2010,R,109 min,"Comedies, Music & Musicals",Ambitious young record company intern Aaron must escort an unruly rock star to Los Angeles for the start of his anniversary concert.
s6841,Movie,Get Santa,Christopher Smith,"Jodie Whittaker, Warwick Davis, Jim Broadbent, Stephen Graham, Nonso Anozie, Rafe Spall, Ewen Bremner, Matt King","United Kingdom, United States","December 12, 2014",2014,PG,103 min,"Children & Family Movies, Comedies","When Santa gets arrested for trespassing after crashing his sleigh, it's up to a father-son team to spring him from jail and save Christmas."
s6843,Movie,Get Smart,Peter Segal,"Steve Carell, Anne Hathaway, Dwayne Johnson, Alan Arkin, Terence Stamp, Terry Crews, David Koechner, James Caan, Masi Oka, Nate Torrence, Bill Murray",United States,"April 1, 2019",2008,PG-13,110 min,"Action & Adventure, Comedies","When the identities of secret agents are compromised, hapless Maxwell Smart teams with far more capable Agent 99 to thwart an evil terrorist group."
