show_id,type,title,director,cast,country,date_added,release_year,rating,duration,listed_in,description
s6922,Movie,Happy Times,Luis Javier M. Henaine,"Luis Arrieta, Cassandra Ciangherotti, Humberto Busto, Iván Arana, Bárbara de Regil, Miguel Rodarte",Mexico,"February 8, 2017",2014,NR,79 min,"Comedies, International Movies, Romantic Movies","Desperate to break up with his clingy girlfriend, a nerdy cartoonist hires a mysterious agency to do the deed. But the agency has unusual methods."
s6925,Movie,Hard Tide,"Robert Osman, Nathanael Wiseman","Nathanael Wiseman, Mem Ferda, Alexandra Newick, Oliver Stark, Kat Gellin, Andy Lucas, Ralph Brown, Beverly Hills",United Kingdom,"September 6, 2017",2015,TV-MA,79 min,"Dramas, Independent Movies",A drug dealer who's been emulating his father's successful criminal career is forced to go on the run with a young girl in this fact-based thriller.
s6926,Movie,Hardcore Henry,Ilya Naishuller,"Sharlto Copley, Danila Kozlovsky, Haley Bennett, Andrey Dementiev, Dasha Charusha, Svetlana Ustinova, Tim Roth, Ilya Naishuller","Russia, United States, China","August 1, 2020",2015,R,96 min,"Action & Adventure, International Movies, Sci-Fi & Fantasy","Shot entirely like a first-person shooter video game, this film tracks Henry, a cyborg racing to save his wife from a villain with paranormal powers."
s6927,Movie,Harlem Globetrotters: The Team That Changed the World,,"Chuck D., Harlem Globetrotters",,"November 1, 2019",2005,TV-14,55 min,"Documentaries, Sports Movies",Relive the greatest moments of the Harlem Globetrotters with this documentary that chronicles the team's legendary 1948 defeat over the Minneapolis Lakers and their historic 1951 Berlin trip.
s6928,Movie,Harold & Kumar Escape from Guantanamo Bay,"Jon Hurwitz, Hayden Schlossberg","John Cho, Kal Penn, Rob Corddry, Jack Conley, Roger Bart, Neil Patrick Harris, Danneel Ackles, Eric Winter, Paula Garcés, Jon Reep, Missi Pyle",United States,"October 1, 2019",2008,R,101 min,"Comedies, Cult Movies",Harold and Kumar jump on a plane to catch up with Harold's love interest but must change their plans when Kumar is accused of being a terrorist.
s6929,Movie,Harold & Kumar Go to White Castle,Danny Leiner,"John Cho, Kal Penn, Paula Garcés, Neil Patrick Harris, David Krumholtz, Eddie Kaye Thomas, Christopher Meloni, Ryan Reynolds, Fred Willard","United States, Canada, Germany","January 1, 2020",2004,R,88 min,"Comedies, Cult Movies",Buddies Harold and Kumar set out to satisfy a stoner craving for hamburgers but end up on an epic journey when they can't find White Castle.
s6930,Movie,Harold and Lillian: A Hollywood Love Story,Daniel Raim,"Harold Michelson, Lillian Michelson, Mel Brooks, Francis Ford Coppola, Danny DeVito",United States,"November 25, 2018",2015,TV-14,95 min,Documentaries,"Storyboard artist Harold Michelson and his film researcher wife, Lillian, recall the influence they had on 60 years of Hollywood's biggest hits."
s6932,Movie,Harriet the Spy: Blog Wars,Ron Oliver,"Jennifer Stone, Kristin Booth, Wesley Morgan, Doug Murray, Shauna MacDonald, Jason Blicker, Jayne Eastwood, Melinda Shankar, Alexander Conti, Vanessa Morgan","United States, Canada","April 15, 2018",2010,TV-G,87 min,"Children & Family Movies, Comedies",Intrepid writer Harriet Welsch is determined to become the class blogger despite stiff competition from her snooty archrival.
s6934,Movie,Harry and Snowman,Ron Davis,Harry DeLeyer,United States,"January 15, 2017",2015,TV-PG,83 min,"Documentaries, Sports Movies","With only a strong will and a cheap horse, a former agent of the Dutch underground in World War II sets out to become a champion show jumper."
s6935,Movie,Harry Benson: Shoot First,"Justin Bare, Matthew Miele",Harry Benson,United States,"May 1, 2017",2016,NR,90 min,Documentaries,"This film chronicles the career of photographer Harry Benson, who earned global renown with his candid shots of the Beatles and other celebrities."
s6937,Movie,Haseena Maan Jaayegi,David Dhawan,"Sanjay Dutt, Govinda, Karisma Kapoor, Pooja Batra, Kader Khan, Paresh Rawal, Satish Kaushik, Aruna Irani, Anupam Kher, Ashish Vidyarthi, Aashif Sheikh, Asrani, Razak Khan, Shakti Kapoor, Bindu, Mahavir Shah, Mohan Joshi, Anil Dhawan",India,"March 1, 2018",1999,TV-PG,151 min,"Action & Adventure, Comedies, Dramas","A millionaire opens the door to comic complications when he punishes his spoiled sons for trying to make money through shady, get-rich-quick schemes."
s6939,Movie,Haunters: The Art of the Scare,Jon Schnitzer,,United States,"January 2, 2018",2017,TV-MA,89 min,"Documentaries, Horror Movies","This documentary takes us into the world of those who create horror simulations for willing audiences, and examines the culture they have spawned."
s6940,Movie,Haunting on Fraternity Row,Brant Sersen,"Jacob Artist, Jayson Blair, Shanley Caswell, Claudia Lee, Ashton Moio, Cameron Moulene, Molly Tarlov, Chester Rushing",United States,"March 1, 2019",2018,TV-MA,99 min,"Horror Movies, Independent Movies","When a fraternity's last big luau serves up horrible deaths to its partygoers, the brothers learn firsthand about their house’s frightening history."
s6941,Movie,Have You Seen the Listers?,Eddie Martin,Anthony Lister,Australia,"February 1, 2019",2017,TV-MA,86 min,"Documentaries, International Movies",This documentary paints a candid picture of Australian street artist Anthony Lister as he navigates his burgeoning career and personal hardships.
s6943,Movie,Havenhurst,Andrew C. Erin,"Julie Benz, Belle Shouse, Josh Stamberg, Danielle Harris, Douglas Tait, Matt Lasky, Dendrie Taylor, Toby Huss, Jennifer Blanc, Fionnula Flanagan",United States,"June 10, 2017",2016,TV-MA,85 min,"Horror Movies, Thrillers","An alcoholic with a tragic past rents an apartment in a building for those in recovery, but soon learns the truth about residents who get ""evicted."""
s6944,Movie,Haywire,Steven Soderbergh,"Gina Carano, Michael Fassbender, Ewan McGregor, Bill Paxton, Channing Tatum, Antonio Banderas, Mathieu Kassovitz, Michael Angarano, Michael Douglas, Anthony Brandon Wong","Ireland, United States","March 1, 2020",2011,R,93 min,Action & Adventure,A last-minute mission in Dublin turns deadly for stunning secret operative Mallory Kane when she realizes she's been betrayed.
s6945,Movie,He Named Me Malala,Davis Guggenheim,Malala Yousafzai,"United States, United Arab Emirates","June 1, 2018",2015,PG-13,89 min,Documentaries,"This documentary tells the story of a teenage Pakistani girl shot for her advocacy of women's education, her survival, and her continued efforts."
s6946,Movie,He's Out There,Quinn Lasher,"Yvonne Strahovski, Anna Pniowsky, Abigail Pniowsky, Ryan McDonald, Justin Bruening, Julian Bailey",United States,"January 12, 2019",2018,R,89 min,"Horror Movies, Thrillers","While vacationing at a remote lake house, a mother and her daughters become pawns in the twisted game of an ax-wielding psychopath."
s6947,Movie,Head Count,Elle Callahan,"Isaac Jay, Ashleigh Morghan, Bevin Bru, Billy Meade, Hunter Peterson, Chelcie May, Tory Freeth, Michael Herman, Amaka Obiechie, Sam Marra, Cooper Rowe",United States,"September 13, 2019",2018,TV-MA,90 min,"Horror Movies, Independent Movies",A group of college students on a weekend getaway accidentally summon a supernatural entity intent on using them for its deadly ritual.
s6948,Movie,Head On,Ana Kokkinos,"Alex Dimitriades, Paul Capsis, Julian Garner, Tony Nikolakopoulos, Elena Mandalis, Eugenia Fragos, Damien Fotiou, Andrea Mandalis, Maria Mercedes, Dora Kaskanis, Alex Papps, Vassili Zappa",Australia,"August 25, 2018",1998,TV-MA,104 min,"Dramas, Independent Movies, LGBTQ Movies","This edgy drama follows 19-year-old Ari, a gay Greek-Australian whose roiling ethnic- and sexual-identity struggles lead to a wild, 24-hour odyssey."
s6949,Movie,Heal,Kelly Noonan,"Kelly Noonan, Deepak Chopra, Michael Beckwith, Joe Dispenza, Dr. Jeffrey Thompson, Gregg Braden, Joan Borysenko, Marianne Williamson",United States,"February 1, 2019",2017,TV-14,107 min,Documentaries,"Stories from spiritual leaders, physicians and those with chronic illnesses reveal the powerful connection between the human psyche and physical health."
s6950,Movie,Heartbreakers,David Mirkin,"Sigourney Weaver, Jennifer Love Hewitt, Ray Liotta, Jason Lee, Gene Hackman, Anne Bancroft, Jeffrey Jones, Nora Dunn, Ricky Jay, Zach Galifianakis",United States,"December 31, 2019",2001,PG-13,124 min,"Comedies, Romantic Movies","In this stylish comedy, a mother-daughter con team makes money the old-fashioned way: They use their feminine wiles to swindle it."
s6951,Movie,Heartthrob,Chris Sivertson,"Aubrey Peeples, Keir Gilchrist, Peter Facinelli, Felicity Price, Ione Skye, Jimmy Bennett, Taylor Dearden",United States,"January 1, 2018",2017,TV-MA,87 min,Thrillers,"A shy, brilliant boy and a popular girl fall into an unexpected romance. But as their bond deepens, his attraction begins taking on dark overtones."
s6953,Movie,Hedgehogs,Huang Jianming,"Anthony Padilla, Ian Hecox, Jenn McAllister, Jon Heder, Chevy Chase","United States, China","April 1, 2019",2016,PG,94 min,Children & Family Movies,"When a hedgehog suffering from memory loss forgets his identity, he ends up on a big city journey with a pigeon to save his habitat from a human threat."
s6955,Movie,Hell and Back,"Tom Gianas, Ross R. Shuman","Nick Swardson, Mila Kunis, Bob Odenkirk, T.J. Miller, Rob Riggle, Susan Sarandon, Danny McBride, Jennifer Coolidge, John Farley, Maria Bamford",United States,"September 6, 2018",2015,R,86 min,"Action & Adventure, Comedies, Independent Movies","When best friends break a blood oath, one of them is cast away to hell, and the other two must save him from the misfits of the underworld."
s6957,Movie,Hell or High Water,David Mackenzie,"Jeff Bridges, Chris Pine, Ben Foster, Gil Birmingham, Marin Ireland, Katy Mixon, Dale Dickey, Kevin Rankin, William Sterchi",United States,"January 1, 2019",2016,R,102 min,"Dramas, Independent Movies","In a desperate bid to save their family ranch, two brothers stage a series of clever bank robberies with a pair of Texas Rangers in hot pursuit."
s6958,Movie,Hellboy,Guillermo del Toro,"Ron Perlman, John Hurt, Selma Blair, Rupert Evans, Karel Roden, Jeffrey Tambor, Doug Jones, Brian Steele, Ladislav Beran, Biddy Hodson, Corey Johnson, Kevin Trainor",United States,"December 1, 2018",2004,PG-13,122 min,"Action & Adventure, Cult Movies, Sci-Fi & Fantasy","This fast-paced action flick tells the dark story of Hellboy, a charismatic demon who's put on Earth by the Nazis to terrorize the rest of the world."
s6959,Movie,Her,Spike Jonze,"Joaquin Phoenix, Scarlett Johansson, Amy Adams, Rooney Mara, Olivia Wilde, Chris Pratt, Matt Letscher, Portia Doubleday",United States,"July 29, 2018",2013,R,126 min,"Dramas, Romantic Movies, Sci-Fi & Fantasy",Love comes to a lonely writer in the sleekest of packages when he finds himself falling for the advanced operating system he bought to run his life.
s6960,Movie,Her Only Choice,Christel Gibson,"Denise Boutte, Timon Kyle Durrett, Leon, Tamara Tunie, Vanessa Bell Calloway, Tiffany Snow, Keith Arthur Bolden, Elise Neal, Jeryl Prescott",United States,"May 2, 2019",2018,TV-14,87 min,Dramas,A woman must decide if she’s willing to end her pregnancy to save her own life after being diagnosed with breast cancer.
s6961,Movie,Hera Pheri,Prakash Mehra,"Amitabh Bachchan, Vinod Khanna, Saira Banu, Sulakshana Pandit, Shreeram Lagoo, Pinchoo Kapoor, P. Jairaj, Yunus Parvez",India,"December 31, 2019",1976,TV-14,156 min,"Action & Adventure, Comedies, Dramas",The bond between two crooks and best friends is threatened when one learns that the other's father had a hand in his own tragic past.
s6962,Movie,Here Alone,Rod Blackhurst,"Lucy Walters, Gina Piersanti, Adam David Thompson, Shane West, Ryken A. Whitfield, Abel McSurely Bradshaw, Rebecca Spiro",United States,"July 1, 2017",2016,TV-MA,97 min,Horror Movies,"When she finally encounters two other survivors, a woman alone in a world decimated by a zombie epidemic struggles to trust her new companions."
s6963,Movie,Hero,Corey Yuen,"Takeshi Kaneshiro, Yuen Biao, Valerie Chow, Jessica Hester Hsuan, Tak Yuen, Wah Yuen, Corey Yuen","Hong Kong, China","August 1, 2018",1997,TV-MA,89 min,"Action & Adventure, International Movies","A pugilist from Shantung struggles to rise to the top of the Shanghai triad ladder, where his stellar martial arts talents can shine."
s6965,Movie,Hickok,Timothy Woodward Jr.,"Luke Hemsworth, Trace Adkins, Kris Kristofferson, Bruce Dern, Cameron Richardson, Kaiwi Lyman, Hunter Fischer, Robert Catrini, Britain Simons",United States,"July 24, 2020",2017,TV-MA,88 min,Action & Adventure,"While serving as the marshal of rowdy Abilene, Kansas, ""Wild Bill"" Hickok uses guns and gall to tidy up the lawless frontier town."
s6967,Movie,Hide & Seek,Shawn Arranha,"Purab Kohli, Arjan Bajwa, Mrinalini Sharma, Sameer Kochhar, Ayaz Khan, Amruta Patki, Pavail Gulati, Prashant, Amol Mhatre",India,"March 1, 2018",2010,TV-14,96 min,"Horror Movies, International Movies, Thrillers","Years after an accident at a wild Christmas party traumatized them all, six former friends find themselves trapped in a shopping mall and forced by a killer disguised as Santa Claus to play a lethal game of hide-and-seek."
s6968,Movie,Hide and Seek,Liu Jie,"Wallace Huo, Qin Hailu, Regina Wan, Jessie Li, Dong Zijian, Li Yiqing, Fan Qianhui",China,"August 19, 2017",2016,TV-14,104 min,"International Movies, Thrillers","While living a comfortable life with his wife and child, a germophobic man realizes his estranged brother may have committed a terrible crime."
s6969,Movie,Highly Strung,Scott Hicks,,Australia,"February 1, 2017",2015,TV-14,80 min,"Documentaries, International Movies, Music & Musicals","Fiery passions take center stage in this intimate look at the Australian String Quartet and, perhaps more vital, the priceless instruments they guard."
s6973,Movie,Hiroshima: The Real History,Lucy van Beek,John Sessions,United Kingdom,"March 31, 2017",2015,TV-PG,95 min,Documentaries,This detailed examination of the 1945 Hiroshima bombing includes the prelude to and aftermath of history's controversial first use of atomic weapons.
s6974,Movie,Hisss,Jennifer Lynch,"Mallika Sherawat, Irrfan Khan, Jeff Doucette, Divya Dutta, Raman Trikha, Mahmoud Babai, Raj Bhansali, Sunny Charles, Tony Ciccone, Parvez Khan","India, United States","December 1, 2017",2010,TV-MA,97 min,"Horror Movies, International Movies, Thrillers","In a plot to bait the snake-goddess Nagin for her immortality-granting essence, George States journeys to India and abducts her reptilian lover."
s6976,Movie,History of Joy,Vishnu Govindhan,"Vishnu Vinay, Vinay Forrt, Saikumar, Joju George, Nobi, Sreekumar, Nandu, Sunil Sukhada",India,"August 1, 2018",2017,TV-14,118 min,"Dramas, International Movies",The life of a high-flying law student takes a drastic turn when a bout of misfortune changes his status in society for good.
s6978,Movie,Hitch,Andy Tennant,"Will Smith, Eva Mendes, Kevin James, Amber Valletta, Julie Ann Emery, Adam Arkin, Robinne Lee, Nathan Lee Graham, Michael Rapaport, Jeffrey Donovan",United States,"January 1, 2020",2005,PG-13,118 min,"Comedies, Romantic Movies","Smooth and sexy Hitch helps clients make a great first impression on a date, but he's thrown when a lovely reporter starts nosing around his business."
s6979,Movie,Hitler's Olympics,Daniel Kontur,,United Kingdom,"August 1, 2016",2016,TV-PG,44 min,"Documentaries, Sports Movies","Hitler, Nazi propaganda and 1936 Berlin Olympics are put under the microscope to uncover hidden truths and the historical legacy of those games."
s6980,Movie,Hitler's Steel Beast,Daniel Ablin,,France,"November 1, 2017",2017,TV-14,54 min,"Documentaries, International Movies","Trace the history of Hitler's armored private train, a 15-car mobile headquarters boasting state-of-the-art communications and anti-aircraft cannons."
s6981,Movie,Ho Mann Jahaan,Asim Raza,"Adeel Hussain, Mahira Khan, Sheheryar Munawar, Sonya Jehan, Bushra Ansari, Nimra Bucha, Arshad Mahmud, Jamal Shah",Pakistan,"July 1, 2017",2015,TV-PG,170 min,"Dramas, International Movies, Romantic Movies","Three friends in modern-day Karachi navigate their post-college lives, while struggling to balance their passion for music with familial obligations."
s6983,Movie,Hokkabaz,"Ali Taner Baltacı, Cem Yılmaz","Cem Yılmaz, Mazhar Alanson, Özlem Tekin, Tuna Orhan, Tuncer Salman, Kemal İnci, Gürgen Öz, Caner Alkaya, Ayçe Abana, Bahtiyar Engin",Turkey,"March 10, 2017",2006,TV-MA,118 min,"Comedies, Dramas, International Movies","Trying to resurrect his career, not-so-talented magician Iskender goes on tour, but things get iffy when one of his illusions works a little too well."
s6984,Movie,Holding the Man,Neil Armfield,"Ryan Corr, Craig Stott, Kerry Fox, Camilla Ah Kin, Sarah Snook, Guy Pearce, Anthony LaPaglia, Geoffrey Rush",Australia,"August 1, 2016",2015,TV-MA,128 min,"Dramas, International Movies, LGBTQ Movies","In 1970s Australia, two teen boys fall in love with each other and defeat obstacles to their 15-year relationship, until a new crisis comes their way."
s6985,Movie,Holidays,"Anthony Scott Burns, Nicholas McCarthy, Adam Egypt Mortimer, Gary Shore, Kevin Smith, Sarah Adina Smith, Scott Stewart, Kevin Kolsch, Dennis Widmyer","Madeleine Coghlan, Savannah Kennick, Ruth Bradley, Ava Acres, Sophie Traub, Jocelin Donahue, Harley Morenstein, Harley Quinn Smith, Ashley Greene, Olivia Roush, Seth Green, Clare Grant, Lorenza Izzo, Andrew Bowen","United States, Ireland","July 15, 2016",2016,TV-MA,106 min,"Comedies, Horror Movies","Eight gleefully grim short tales set on Halloween, Mother's Day, St. Patrick's Day and other holidays comprise this chilling horror anthology."
s6986,Movie,Holy Hell,Will Allen,,United States,"September 1, 2016",2016,NR,103 min,Documentaries,An ex-member charts his path from idealism to disenchantment in a California cult when alarming revelations about the group's leader come to light.
s6987,Movie,Holy Man 2,Note Chern-Yim,"Apisit Opasaimlikit, Suthep Po-ngam, Phichet Iamchaonaa, Note Chern-Yim",Thailand,"July 30, 2018",2008,TV-14,92 min,"Comedies, Faith & Spirituality, International Movies","Former rap musician Joey Boy is now a monk who takes Father Teng's place at his rural temple, where a crisis develops involving a nearby stone quarry."
s6988,Movie,Holy Man 3,Note Chern-Yim,"Krissada Sukosol, Natee Aekwijit, Yoakyake Chernyim, Der Doksadao, Note Chern-Yim, Kohtee Aramboy, Chaleumpol Tikumpornteerawong",Thailand,"July 30, 2018",2010,TV-MA,102 min,"Comedies, Faith & Spirituality, International Movies","Two new monks, one of them a former rock music star seeking inner peace, join a temple plagued by thieves who are stealing its valuable holy relics."
s6989,Movie,Hombanna,Rakshith Thirthahalli,"Subbu Talabi, Dhanu Gowda, H.G. Dattatreya, Suchendra Prasad, Ambujakshi, Neenasam Ashwath",India,"May 1, 2018",2017,TV-14,126 min,"Dramas, International Movies","In the forests of Karnataka, a farmer and his community face eviction from the land when they get caught in the currents of socio-political change."
s6990,Movie,Homeland,Anindya Chatterjee,"Parambrata Chatterjee, Ani Hovhannisyan, Jonathan Dumontier, Varzu, Sylvie de Neef, Prakashchandra Roy, Nicolas Pierson, Anahit Simonyan",,"October 15, 2019",2019,TV-PG,73 min,"Dramas, Independent Movies, International Movies","Determined to trace her ancestral history, an Armenian woman travels to a French village, where she befriends a kind man and, better yet, finds herself."
s6991,Movie,Honey 2,Bille Woodruff,"Kat Graham, Mario Lopez, Audrina Patridge, Seychelle Gabriel, Randy Wayne, Brandon Molale, Melissa Molinaro, Jossara Jinaro, Lonette McKee, Laurieann Gibson, Christopher Shazar",United States,"October 1, 2019",2011,PG-13,111 min,"Dramas, Romantic Movies","Determined to prove herself as a street dancer, Maria heads from juvie to a Bronx rec center where she's introduced to her dance idol, Honey Daniels."
s6992,Movie,Honey: Rise Up and Dance,Bille Woodruff,"Teyana Taylor, Sierra Aylina McClain, Bryshere Gray",United States,"April 3, 2018",2018,PG-13,100 min,Dramas,"Despite discouragement from her loved ones, a talented street dancer tries out for an exclusive dance crew in a bid to win a college scholarship."
s6993,Movie,Hoodwinked Too! Hood vs. Evil,Mike Disa,"Hayden Panettiere, Glenn Close, Patrick Warburton, Joan Cusack, David Ogden Stiers, Bill Hader, Amy Poehler, Andy Dick, Martin Short, Brad Garrett, Cheech Marin, Tommy Chong, Heidi Klum, Wayne Newton",United States,"November 3, 2018",2011,PG,86 min,"Children & Family Movies, Comedies","Fresh off a top-secret training, feisty heroine Little Red teams up with intrepid reporter Wolf to investigate the disappearance of Hansel and Gretel."
s6994,Movie,Hope Aur Hum,Sudip Bandyopadhyay,"Naseeruddin Shah, Kabir Sajid, Sonali Kulkarni, Amir Bashir, Naveen Kasturia, Neha Chauhan, Virti Vaghani",India,"September 1, 2018",2018,TV-14,95 min,"Children & Family Movies, Comedies, Dramas","A multigenerational household navigates daily life, evolving relationships and clashes between old and new mindsets in this light family drama."
s6995,Movie,Hope Springs Eternal,Jack C. Newell,"Mia Rose Frampton, Beth Lacke, Stony Blyden, Juliette Angelo, Lauren Giraldo, Beau Brooks, Pej Vahdat",United States,"November 8, 2018",2018,PG,79 min,Dramas,"When a teen with terminal cancer miraculously finds herself in remission, she struggles to give up the attention her illness gave her at school."
s6996,Movie,Hope: One in a Billion,Brodje Wemboendja,Gift Ngoepe,"United States, South Africa","December 15, 2019",2017,TV-14,81 min,"Documentaries, International Movies, Sports Movies","The remarkable true story of Gift Ngoepe, the first African to play for Major League Baseball, is recounted in this inspiring documentary."
s6998,Movie,Horns,Alexandre Aja,"Daniel Radcliffe, Juno Temple, Max Minghella, Joe Anderson, Kelli Garner, Heather Graham, David Morse, Kathleen Quinlan, James Remar","United States, Canada","August 1, 2019",2013,R,120 min,"Dramas, Horror Movies, Sci-Fi & Fantasy","Accused of murder, Ig Perish wakes up one day to find he's grown a set of horns – compelling people to confess their sins to him."
s7000,Movie,Horror Story,Ayush Raina,"Karan Kundra, Nishant Malkani, Hassan Zaidi, Ravish Desai, Radhika Menon, Aparna Bajpai, Nandini Vaid, Sheetal Singh, Bikramjeet Singh, Masood Akhtar",India,"April 12, 2019",2013,TV-14,85 min,"Horror Movies, International Movies","On a dare, seven college friends spend a night at an abandoned hotel rumored to be haunted and find themselves trapped in a nightmare."
s7001,Movie,Hostage to the Devil,Marty Stalker,,"Ireland, United Kingdom, Italy, United States","January 15, 2017",2016,TV-14,96 min,"Documentaries, International Movies","Follow the eerie story of Father Malachi Martin, a disenchanted priest whose belief in demonic possession would lead him to conduct several exorcisms."
s7002,Movie,Hostages,Federico Lemos,,,"January 29, 2018",2017,TV-PG,91 min,"Documentaries, International Movies","Witnesses recount the shocking 1996 hostage crisis in Lima, Peru, where rebels held scores of high-level figures captive at an ambassador's residence."
s7003,Movie,Hostiles,Scott Cooper,"Christian Bale, Rosamund Pike, Wes Studi, Jesse Plemons, Timothée Chalamet, Ben Foster, Adam Beach, Rory Cochrane, Peter Mullan, Scott Wilson, Paul Anderson, Jonathan Majors, John Benjamin Hickey, Q'orianka Kilcher, Ryan Bingham",United States,"August 15, 2018",2017,R,134 min,Dramas,"After a long career battling the Cheyenne, a U.S. Army captain is ordered to safely escort the tribe's most influential chief to his Montana homeland."
s7004,Movie,Hot Bot,Michael Polish,"Cynthia Kirchner, Doug Haley, Zack Pearlman, Larry Miller, Danny Masterson, Anthony Anderson, David Shackelford, Donald Faison, Angela Kinsey, Kirby Bliss Blanton, John Robinson",United States,"March 1, 2016",2016,NR,93 min,Comedies,"Two teenage geeks inadvertently find a lifelike, state-of-the-art sex robot, but must dodge the high-profile owner who lost her in order to keep her."
s7005,Movie,Hot Property,Max McGill,"MyAnna Buring, Tom Rhys Harries, Ella Smith, Sam Phillips, Kate Bracken",United Kingdom,"August 13, 2017",2016,TV-MA,82 min,"Comedies, Independent Movies","When a resourceful but flighty Londoner is threatened with eviction, she vows to do whatever it takes to defeat a greedy real estate agent."
s7006,Movie,Hot Rod,Akiva Schaffer,"Andy Samberg, Jorma Taccone, Bill Hader, Danny McBride, Isla Fisher, Sissy Spacek, Ian McShane, Will Arnett, Chris Parnell, Chester Tam",United States,"November 20, 2019",2007,PG-13,88 min,"Comedies, Sports Movies",Andy Samberg stars in this comedy as an accident-prone daredevil who's determined to jump 15 buses on his moped and impress his abusive stepfather.
s7008,Movie,Hotel Pacific,Janusz Majewski,"Marek Kondrat, Roman Wilhelmi, Roman Skamene, Čestmír Řanda, Michał Pawlicki, Martin Hron, Stanisława Celińska, Joanna Kasperska, Jaroslava Schallerová","Poland,","October 1, 2019",1975,TV-MA,96 min,"Classic Movies, Dramas, International Movies",A motivated teen strives to rise from dishwasher to waiter at a luxury hotel only to tread in the abusive tide of its workplace hierarchy.
s7009,Movie,Hotel Transylvania 3: Summer Vacation,Genndy Tartakovsky,"Adam Sandler, Selena Gomez, Kevin James, Kathryn Hahn, Andy Samberg, David Spade, Steve Buscemi, Fran Drescher, Molly Shannon, Mel Brooks, Keegan-Michael Key",United States,"January 24, 2019",2018,PG,97 min,"Children & Family Movies, Comedies","It's love at first sight for Dracula when he meets Ericka, the charming but mysterious captain of the monster cruise that Mavis plans for the family."
