show_id,type,title,director,cast,country,date_added,release_year,rating,duration,listed_in,description
s7171,Movie,Kate & Leopold,James Mangold,"Meg Ryan, Hugh Jackman, Liev Schreiber, Breckin Meyer, Natasha Lyonne, Bradley Whitford, Paxton Whitehead, Spalding Gray, Josh Stamberg, Matthew Sussman",United States,"January 1, 2020",2001,PG-13,118 min,"Comedies, Romantic Movies",A present-day woman takes responsibility for guiding a charming time-traveling 19th-century nobleman through the 21st century.
s7172,Movie,Katha,Sai Paranjape,"Farooq Shaikh, Naseeruddin Shah, Deepti Naval, Veeni Paranjape Joglekar, Mallika Sarabhai, Arun Joglekar",India,"December 31, 2019",1982,TV-PG,140 min,"Comedies, Dramas, Independent Movies","Secretly in love with his neighbor, a mild-mannered clerk is heartbroken when his much bolder, more charming friend wins her heart instead."
s7173,Movie,Katt Williams: Live,Alphonso J. Wesson,Katt Williams,United States,"July 19, 2018",2006,NR,85 min,Stand-Up Comedy,"Outspoken comedian Katt Williams pokes fun at a variety of topics, including sex, relationships, parenthood and trying to make it as an entertainer."
s7174,Movie,Kaviyude Osyath,Vineeth Anil,"Prakash Bare, Arun Kumar, Kulappulli Leela, Sangeetha Mohan, Kochu Preman",India,"July 1, 2018",2017,TV-14,116 min,"Dramas, International Movies","When a late poet leaves behind his property to a young man, the man's brother suspects the poet may have been more than just a family friend."
s7175,Movie,Kay Dyache Bola,Chandrakant Kulkarni,"Makarand Anaspure, Akshay Pendse, Umesh Kamat, Sharvari Jamenis, Sachin Khedekar, Arun Nalawade, Mohan Agashe, Nirmiti Sawant, Sanjay Mone, Amita Khopkar, Pushkar Shrotri, Ganesh Yadav",India,"January 1, 2018",2005,TV-14,133 min,"Comedies, Dramas, International Movies","Wrongfully accused of murder, two students' last hope lies with their defense attorney, an inexperienced bumbler who's never even tried a case."
s7179,Movie,Kevin Hart: Laugh at My Pain,"Leslie Small, Tim Story",Kevin Hart,United States,"October 1, 2018",2011,R,89 min,Stand-Up Comedy,"Sometimes edgy and always hilarious, comedian Kevin Hart shines in this theatrical version of his record-breaking 2011 live tour."
s7180,Movie,Kevin Hart: Let Me Explain,"Leslie Small, Tim Story",Kevin Hart,United States,"July 13, 2018",2013,R,75 min,Stand-Up Comedy,"Philadelphia funnyman Kevin Hart takes the stage in front of a sold-out crowd at Madison Square Garden, part of his hit ""Let Me Explain"" world tour."
s7181,Movie,Kevin Hart: Seriously Funny,Shannon Hartman,Kevin Hart,United States,"October 1, 2018",2010,TV-MA,67 min,Stand-Up Comedy,"With his unique hip-hop style delivery, African American stand-up comedian Kevin Hart expounds on life at a sold-out concert performance."
s7182,Movie,Kevyn Aucoin: Beauty & the Beast in Me,Lori Kaye,"Kevyn Aucoin, Cindy Crawford, Naomi Campbell, Gwyneth Paltrow, Andie MacDowell, Paulina Porizkova, Amber Valletta",United States,"January 1, 2019",2017,TV-MA,90 min,"Documentaries, LGBTQ Movies",Makeup artist Kevyn Aucoin worked with top supermodels in the 1980s and 1990s. Personal videos merged with interviews provide a peek into his life.
s7184,Movie,Khalnayak,Subhash Ghai,"Sanjay Dutt, Madhuri Dixit, Jackie Shroff, Anupam Kher, Rakhee Gulzar, Pramod Moutho, Ramya Krishnan, Sushmita Mukherjee, Neena Gupta, A.K. Hangal",India,"March 1, 2018",1993,TV-14,170 min,"Action & Adventure, Dramas, International Movies",A prison guard goes undercover as a dancer to try and recapture an escaped criminal and restore her police inspector boyfriend's reputation.
s7187,Movie,Khosla Ka Ghosla,Dibakar Banerjee,"Anupam Kher, Boman Irani, Parvin Dabas, Tara Sharma, Navin Nischol, Kiran Juneja, Ranvir Shorey, Vinod Nagpal, Vinay Pathak, Nitish Pandey",India,"August 2, 2018",2006,TV-14,124 min,"Comedies, Dramas, International Movies",A cranky control freak must rely on his comically dysfunctional family to pull off a scam on a greedy land shark who's stolen his prized property.
s7189,Movie,Khubsoorat,Hrishikesh Mukherjee,"Ashok Kumar, Rekha, Rakesh Roshan, Shashikala, Aradhana, Dina Pathak, David Abraham, S.N. Banerjee, Keshto Mukherjee",India,"December 31, 2019",1980,TV-PG,120 min,"Classic Movies, Comedies, Dramas",A strict matriarch's regimented household is upended by the arrival of a spunky relative who challenges the rules.
s7190,Movie,Khushi,"Surya S.J., Sunil Kumar Agrawal","Fardeen Khan, Kareena Kapoor, Amrish Puri, Navin Nischol, Beena, Anup Soni, Johnny Lever, Sharat Saxena, Amitabh Bachchan, Sakshi Shivanand",India,"March 1, 2018",2003,TV-14,157 min,"Comedies, International Movies, Music & Musicals","While playing matchmaker to a pair of their friends, two young university students begin developing feelings for each other."
s7191,Movie,Kia and Cosmos,Sudipto Roy,"Ritwika Pal, Swastika Mukherjee, Joy Sengupta",India,"May 1, 2019",2018,TV-14,124 min,"Dramas, Independent Movies, International Movies",A 15-year-old girl with autism attempts to write a mystery novel based on her hunt for the killer of a neighborhood cat.
s7192,Movie,Kickboxer: Retaliation,Dimitri Logothetis,"Alain Moussi, Jean-Claude Van Damme, Mike Tyson, Christopher Lambert, Sara Malakul Lane, Hafþór Júlíus Björnsson, Sam Medina, Steven Swadling",United States,"April 26, 2018",2017,R,110 min,Action & Adventure,"Sloan's vow to never return to Thailand is cut short when he's kidnapped and taken to a Thai prison, where he's forced to fight a 400-pound brute."
s7193,Movie,Kickboxer: Vengeance,John Stockwell,"Alain Moussi, Jean-Claude Van Damme, Dave Bautista, Gina Carano, Georges St-Pierre, Sara Malakul Lane, Matthew Ziff, T.J. Storm, Fabricio Werdum, Cain Velasquez",United States,"December 8, 2016",2016,TV-MA,90 min,Action & Adventure,"After a skilled fighter falls in the ring, his younger brother emerges from the shadows to train and get revenge against a brutal champion."
s7194,Movie,Kicking and Screaming,Noah Baumbach,"Josh Hamilton, Olivia d'Abo, Carlos Jacott, Chris Eigeman, Eric Stoltz, Jason Wiles, Parker Posey, Cara Buono, Elliott Gould, Samuel Gould",United States,"November 4, 2019",1995,R,97 min,"Comedies, Independent Movies, Romantic Movies","After graduating, four college roomies – petrified by the prospect of facing ""real life"" – reluctantly step into adulthood in this ensemble comedy."
s7195,Movie,Kid Kulafu,Paul Soriano,"Robert Villar, Alessandra de Rossi, Cesar Montano, Alex Medina, Jake Macapagal, Khalil Ramos, Jomari Angeles, Kokoy DeSantos",Philippines,"March 4, 2019",2015,TV-14,108 min,"Dramas, International Movies, Sports Movies","Growing up in poverty and political turmoil, he found his way out in the ring. The early years of world-famous boxer Manny Pacquiao unfolds in this biopic."
s7196,Movie,Kidnapping Mr. Heineken,Daniel Alfredson,"Jim Sturgess, Sam Worthington, Ryan Kwanten, Anthony Hopkins, Mark van Eeuwen, Thomas Cocquerel, Jemima West, David Dencik","Netherlands, Belgium, United Kingdom, United States","September 8, 2017",2015,R,95 min,"Action & Adventure, Dramas, International Movies","When beer magnate Alfred ""Freddy"" Heineken is kidnapped in 1983, his abductors make the largest ransom demand in history."
s7198,Movie,Kill Bill: Vol. 1,Quentin Tarantino,"Uma Thurman, Lucy Liu, Vivica A. Fox, Daryl Hannah, David Carradine, Michael Madsen, Julie Dreyfus, Chiaki Kuriyama, Sonny Chiba, Gordon Liu","United States, Japan","January 1, 2020",2003,R,111 min,Action & Adventure,"An assassin is shot by her ruthless employer, Bill, and other members of their assassination circle. But she lives – and plots her vengeance."
s7199,Movie,Kill Bill: Vol. 2,Quentin Tarantino,"Uma Thurman, David Carradine, Michael Madsen, Daryl Hannah, Gordon Liu, Michael Parks, Perla Haney-Jardine, Helen Kim, Claire Smithies, Clark Middleton",United States,"January 1, 2020",2004,R,137 min,Action & Adventure,"The Bride has three left on her rampage list: Budd, Elle Driver and Bill himself. But when she arrives at Bill's house, she's in for a surprise."
s7200,Movie,Kill Command,Steven Gomez,"Vanessa Kirby, David Ajala, Mike Noble, Bentley Kalu, Tom McKay, Kelly Gough, Osi Okerafor, Damian Kell, Tim Ahern, Deborah Rosan, Thure Lindhardt",United Kingdom,"February 23, 2017",2016,TV-MA,100 min,"Action & Adventure, Independent Movies, Sci-Fi & Fantasy","On a remote island, elite soldiers discover their training exercise is actually an experimental death trap teeming with efficiently lethal robots."
s7201,Movie,Kill Hitler! The Luck of the Devil,Frédéric Tonolli,Jean-Baptiste Marcenac,France,"May 1, 2019",2015,TV-14,53 min,"Documentaries, International Movies","From politicians to officers, many attempted to kill Hitler – and failed. This documentary delves into the details of how their plots unraveled."
s7202,Movie,Kill Ratio,Paul Tanter,"Tom Hopper, Amy Huberman, Lacy Moore, Brian McGuinness, Luke Pierucci, Nick Dunning",United States,"February 17, 2017",2016,TV-MA,87 min,Action & Adventure,"Posing as a telecom salesman at a business conference, a CIA agent fights to protect a fledgling Eastern European democracy from a military coup."
s7203,Movie,Kill the Irishman,Jonathan Hensleigh,"Ray Stevenson, Vincent D'Onofrio, Val Kilmer, Christopher Walken, Linda Cardellini, Fionnula Flanagan, Jason Butler Harner, Vinnie Jones, Paul Sorvino, Marcus Thomas, Tony Darrow",United States,"August 21, 2020",2011,R,106 min,"Action & Adventure, Dramas, Independent Movies","This true crime tale charts the rise and fall of mobster Danny Greene, who faced down the Mafia to gain control of organized crime in 1970s Cleveland."
s7204,Movie,Killer Klowns from Outer Space,Stephen Chiodo,"Grant Cramer, Suzanne Snyder, John Allen Nelson, John Vernon, Michael S. Siegel, Peter Licassi, Royal Dano, Christopher Titus, Irene Michaels, Karla Sue Krull",United States,"April 1, 2020",1988,PG-13,86 min,"Comedies, Cult Movies, Horror Movies","An alien band of killer clowns descends from the cosmos to harvest scores of small-town victims, cocooning their prey in cotton candy to eat later."
s7205,Movie,Killers,Robert Luketic,"Katherine Heigl, Ashton Kutcher, Tom Selleck, Catherine O'Hara, Katheryn Winnick, Kevin Sussman, Lisa Ann Walter, Casey Wilson, Rob Riggle, Martin Mull, Alex Borstein",United States,"January 1, 2021",2010,PG-13,100 min,"Action & Adventure, Comedies, Romantic Movies","After a whirlwind romance, Jen and Spencer settle into married life — until Spencer's secret past as a hit man shakes up their suburban bliss."
s7206,Movie,Kills on Wheels,Attila Till,"Szabolcs Thuróczy, Zoltán Fenyvesi, Adám Fekete, Dusan Vitanovic, Mónika Balsai, Lidia Danis, Zoltán Mucsi",Hungary,"March 15, 2018",2016,TV-MA,103 min,"Action & Adventure, Dramas, International Movies","Two young men with disabilities befriend a hitman in a wheelchair and become his helpers, only to wind up in the crosshairs of a Serbian mobster."
s7207,Movie,Kilo Two Bravo,Paul Katis,"David Elliot, Mark Stanley, Scott Kyle, Benjamin O'Mahony, Bryan Parry, Liam Ainsworth, Andy Gibbins, John Doughty, Paul Luebke, Thomas Davison, Grant Kilburn, Robert Mitchell, Jon-Paul Bell, Malachi Kirby, Ali Cook",United Kingdom,"March 1, 2019",2014,R,109 min,"Dramas, Independent Movies, Thrillers","On patrol in Afghanistan, a British paratrooper unit unwittingly ventures into a dry riverbed that turns out to be littered with land mines."
s7208,Movie,King Jack,Felix Thompson,"Charlie Plummer, Cory Nichols, Christian Madsen, Danny Flaherty, Erin Davie, Chloe Levine",United States,"July 1, 2016",2015,NR,81 min,"Dramas, Independent Movies","Already coping with a bully, a mercurial older brother and summer school, 15-year-old Jack is saddled with his young cousin for an eventful weekend."
s7209,Movie,King's Ransom,Jeffrey W. Byrd,"Anthony Anderson, Jay Mohr, Kellita Smith, Nicole Ari Parker, Regina Hall, Loretta Devine, Donald Faison, Leila Arcieri, Charlie Murphy, Brooke D'Orsay","United States, Canada","November 1, 2019",2005,PG-13,98 min,"Action & Adventure, Comedies","A wealthy, despicable businessman comes to the realization that he may lose half his fortune to the obnoxious wife he's trying to divorce. So, he decides to arrange his own kidnapping in order to wipe himself out and claim poverty."
s7211,Movie,Kingpin,"Peter Farrelly, Bobby Farrelly","Woody Harrelson, Randy Quaid, Vanessa Angel, Bill Murray, Chris Elliott, William Jordan, Richard Tyson, Lin Shaye",United States,"January 1, 2020",1996,PG-13,114 min,"Comedies, Cult Movies, Sports Movies","After a bowler loses his hand, his career takes a nosedive. That is, until he uncovers the next big thing: an Amish kid named Ishmael."
s7212,Movie,Kings,Deniz Gamze Ergüven,"Halle Berry, Daniel Craig, Lamar Johnson, Kaalan Walker, Rachel Hilson, Issac Ryan Brown, Callan Farris, Serenity Reign Brown, Reece Cody, Aiden Akpan","France, Belgium, China, United States","October 29, 2018",2017,R,87 min,Dramas,A foster mom and her houseful of kids befriend a bitter neighbor after the Rodney King verdict is handed down in 1992 Los Angeles.
s7213,Movie,Kis Kisko Pyaar Karoon,"Abbas Alibhai Burmawalla, Mastan Alibhai Burmawalla","Kapil Sharma, Arbaaz Khan, Varun Sharma, Sharat Saxena, Supriya Pathak, Manoj Joshi, Manjari Fadnis, Simran Kaur Mundi, Elli Avram, Jamie Lever",India,"November 1, 2017",2015,TV-PG,132 min,"Comedies, International Movies","A man's decision to marry three women, to keep them from committing suicide, complicates his relationship with his girlfriend."
s7214,Movie,Kiss the Girls,Gary Fleder,"Morgan Freeman, Ashley Judd, Cary Elwes, Alex McArthur, Tony Goldwyn, Jay O. Sanders, Bill Nunn, Brian Cox",United States,"January 1, 2020",1997,R,116 min,Thrillers,A forensic psychologist teams up with an escaped kidnapping victim to hunt down a serial killer who abducts and dominates strong-willed women.
s7217,Movie,KL Zombi,Woo Ming Jin,"Zizan Razak, Siti Saleha, Zain Hamid, Izara Aishah, Fadzli Daniel Ali, Usop Wilcha",Malaysia,"August 21, 2017",2013,TV-14,92 min,"Comedies, Horror Movies, International Movies",A field hockey-playing pizza delivery boy finds himself transformed from slacker to zombie slayer during an outbreak of the undead in Kuala Lumpur.
s7219,Movie,Knock Knock,Eli Roth,"Keanu Reeves, Lorenza Izzo, Ana de Armas, Aaron Burns, Ignacia Allamand, Dan Baily, Megan Baily, Colleen Camp, Antonio Quercia","United States, Chile, Israel","November 1, 2020",2015,R,99 min,"Horror Movies, Thrillers",A devoted husband and father on his own for the weekend has his life turned inside out after giving shelter to two young women during a storm.
s7220,Movie,Know Your Enemy - Japan,"Frank Capra, Joris Ivens","Walter Huston, Dana Andrews",United States,"March 31, 2017",1945,TV-14,63 min,"Classic Movies, Documentaries","Though culturally insensitive by modern standards, this propaganda film examines the history of Japan from the 16th century through the 1930s."
s7221,Movie,Knowing,Alex Proyas,"Nicolas Cage, Chandler Canterbury, Rose Byrne, Lara Robinson, D.G. Maloney, Nadia Townsend, Alan Hopgood, Adrienne Pickering","United States, United Kingdom, Australia","October 1, 2019",2009,PG-13,121 min,"Sci-Fi & Fantasy, Thrillers",An MIT astrophysics professor and his son unearth a string of numbers from a time capsule that seem to reveal a cataclysm that will wipe out humanity.
s7222,Movie,Koko: The Gorilla Who Talks,Jonathan Taylor,Demetri Goritsas,United Kingdom,"March 1, 2017",2016,TV-G,56 min,Documentaries,"Witness the incredible, decades-long friendship between Koko the gorilla and Penny Patterson, who taught Koko to communicate via sign language."
s7224,Movie,Kon-Tiki,"Joachim Rønning, Espen Sandberg","Pål Sverre Hagen, Anders Baasmo Christiansen, Tobias Santelmann, Gustaf Skarsgård, Odd Magnus Williamson, Jakob Oftebro, Agnes Kittelsen, Peter Wight, Amund Hellum Noraker, Eilif Hellum Noraker","United Kingdom, Norway, Denmark, Germany, Sweden","April 26, 2019",2012,PG-13,96 min,"Action & Adventure, Dramas, International Movies","With five loyal friends in tow, explorer Thor Heyerdahl sails a fragile balsa wood raft along an ancient path some 4,300 miles across the Pacific."
s7225,Movie,Koshish,Gulzar,"Sanjeev Kumar, Jaya Bhaduri, Asrani, Seema, Om Shivpuri, Dina Pathak",India,"December 31, 2019",1972,TV-14,115 min,"International Movies, Romantic Movies",A speech and hearing-impaired couple persists through unforgiving obstacles to be accepted by society and live a life of dignity.
s7226,Movie,Kraftidioten,Hans Petter Moland,"Stellan Skarsgård, Pål Sverre Hagen, Bruno Ganz, Hildegun Riise, Peter Andersson, Birgitte Hjort Sørensen, Jakob Oftebro, Anders Baasmo Christiansen, Jon Øigarden, Gard B. Eidsvold, Kristofer Hivju, Birgitte Hjort Sorensen, Stellan Skarsgard","Norway, Denmark, Sweden","January 5, 2017",2014,TV-MA,117 min,"Comedies, International Movies, Thrillers","When he sets out to avenge his son's murder, mild-mannered snowplow driver Nils sparks a war between a Norwegian mobster and his Serbian rival."
s7227,Movie,Krish Trish and Baltiboy,,"Damandeep Singh Baggan, Smita Malhotra, Baba Sehgal",,"September 8, 2017",2009,TV-Y7,58 min,Children & Family Movies,"A team of minstrels, including a monkey, cat and donkey, narrate folktales from the Indian regions of Rajasthan, Kerala and Punjab."
s7228,Movie,Krish Trish and Baltiboy: Battle of Wits,"Munjal Shroff, Tilak Shetty","Damandeep Singh Baggan, Smita Malhotra, Baba Sehgal, Deepak Chachra",,"September 8, 2017",2013,TV-Y7,62 min,Children & Family Movies,"An artisan is cheated of his payment, a lion of his throne and a brother of his inheritance in these three stories of deception and justice."
s7229,Movie,Krish Trish and Baltiboy: Best Friends Forever,"Munjal Shroff, Tilak Shetty","Damandeep Singh Baggan, Smita Malhotra, Deepak Chachra",,"September 8, 2017",2016,TV-Y,65 min,Children & Family Movies,"A cat, monkey and donkey team up to narrate folktales about friendship from Northeast India, and the Indian regions of Bihar and Rajasthan."
s7230,Movie,Krish Trish and Baltiboy: Comics of India,Tilak Shetty,"Damandeep Singh Baggan, Smita Malhotra, Baba Sehgal",,"September 8, 2017",2012,TV-Y7,61 min,Children & Family Movies,"In three comic-strip-style tales, a boy tries to sell wisdom, a demon is released from captivity, and a king assigns impossible tasks to his minister."
s7231,Movie,Krish Trish and Baltiboy: Face Your Fears,Tilak Shetty,"Tarun Ratnani, Smita Malhotra, Deepak Chachra",India,"November 17, 2017",2017,TV-Y7,65 min,Children & Family Movies,"In three tales about fear, a baby elephant gets captured by a circus, two boys enter a haunted house and a parrot faces his fear of flying."
s7232,Movie,Krish Trish and Baltiboy: Oversmartness Never Pays,Tilak Shetty,"Rishi Gambhir, Smita Malhotra, Deepak Chachra",,"September 8, 2017",2017,TV-Y7,65 min,Children & Family Movies,"A cat, monkey and donkey learn the consequences of cheating through stories from the Indian regions of Rajasthan, West Bengal and Maharashtra."
s7233,Movie,Krish Trish and Baltiboy: Part II,,"Damandeep Singh Baggan, Smita Malhotra, Baba Sehgal",,"September 8, 2017",2010,TV-Y7,58 min,Children & Family Movies,"Animal minstrels narrate stories about a monkey's friendship with a crocodile, two monkeys' foolishness and a villager's encounter with a demon."
s7234,Movie,Krish Trish and Baltiboy: The Greatest Trick,"Munjal Shroff, Tilak Shetty","Damandeep Singh Baggan, Smita Malhotra, Baba Sehgal",,"September 8, 2017",2013,TV-Y7,60 min,Children & Family Movies,"The consequences of trickery are explored in stories involving an inconsiderate husband, two greedy courtiers, and a kind man who loses everything."
s7235,Movie,Krisha,Trey Edward Shults,"Krisha Fairchild, Alex Dobrenko, Robyn Fairchild, Chris Doubek, Victoria Fairchild, Bryan Casserly, Chase Joliet, Atheena Frizzell, Augustine Frizzell, Bill Wise, Olivia Grace Applegate, Trey Edward Shults",United States,"November 7, 2018",2015,R,81 min,"Dramas, Independent Movies","After 10 years away from her family, Krisha returns for Thanksgiving, but bitter grudges and troubling addictions threaten to ruin the event."
s7237,Movie,Kristy,Oliver Blackburn,"Haley Bennett, Ashley Greene, Erica Ash, Lucas Till, Chris Coy, Al Vicente, Wayne Pére, Jon Arthur, Mike Seal",United States,"October 31, 2015",2013,NR,85 min,Horror Movies,"Opting to stay on campus over the Thanksgiving holiday, coed Justine and a handful of friends find their break violently disrupted by a sadistic gang."
s7238,Movie,Krystal,William H. Macy,"Rosario Dawson, Nick Robinson, Jacob Latimore, Grant Gustin, William H. Macy, Kathy Bates, Felicity Huffman, William Fichtner, T.I., Rick Fox, Amy Parrish",United States,"January 1, 2019",2017,R,93 min,"Comedies, Dramas",A kid with a heart condition falls for an ex-stripper with a lot of baggage and joins her Alcoholics Anonymous group to catch her attention.
s7239,Movie,Kuldip Patwal: I Didn't Do It!,Remy Kohli,"Deepak Dobriyal, Gulshan Devaiah, Raima Sen, Parvin Dabas, Anurag Arora, Jameel Khan, Priyanka Setia",India,"December 31, 2019",2017,TV-MA,126 min,"Dramas, Independent Movies, International Movies","Accused of killing a politician, a local grocer’s fight to prove his innocence reveals his lifelong struggles with injustice leading up to the incident."
s7240,Movie,Kung Fu Hustle,Stephen Chow,"Stephen Chow, Yuen Wah, Yuen Qiu, Lam Chi-chung, Dong Zhihua, Chiu Chi-ling, Xing Yu, Danny Chan Kwok-kwan, Leung Siu-lung","Hong Kong, China, United States","April 1, 2020",2004,R,99 min,"Action & Adventure, Comedies, Cult Movies","Sing, a mobster in 1940s China, longs to be as cool as the formally clad Axe Gang, a band of killers who rule Hong Kong, but can only pretend."
s7241,Movie,Kung Fu Magoo,Andrés Couturier,"Dylan Sprouse, Cole Sprouse, Alyson Stoner, Tom Kenny, Chris Parnell, Rodger Bumpass, Maile Flanagan, Wally Wingert, Candi Milo, Jim Ward","Mexico, United States","August 1, 2018",2010,TV-Y7,79 min,"Children & Family Movies, Comedies","Shortsighted curmudgeon Mr. Magoo and his young nephew, Justin, fight such nefarious foes as kung fu villains, robot spiders and teenage mutants."
s7242,Movie,Kung Fu Panda: Holiday,Tim Johnson,"Jack Black, Angelina Jolie, Dustin Hoffman, Jackie Chan, Seth Rogen, Lucy Liu, David Cross, James Hong, Dan Fogler",United States,"December 1, 2012",2010,TV-PG,26 min,"Children & Family Movies, Comedies","As preparations for the Winter Feast build, Po is caught between his obligations as the Dragon Warrior and his family holiday traditions."
s7243,Movie,Kung Fu Yoga,Stanley Tong,"Jackie Chan, Disha Patani, Amyra Dastur, Sonu Sood, Aarif Rahman, Miya Muqi, Zhang Yixing, Eric Tsang","China, India, Nepal","October 6, 2017",2017,TV-PG,107 min,"Action & Adventure, Comedies, International Movies",Two mismatched archaeologists battle a team of vicious mercenaries in a race to discover an ancient Tibetan treasure of unimaginable worth.
s7244,Movie,Kuppivala,Suresh Pillai,"Nandu, Kochu Preman, Jayakrishnan, Mohan Ayroor, M.R. Gopakumar, Shanawas, Adoor Ajayan, Dinesh Panicker",,"August 1, 2018",2017,TV-14,133 min,"Dramas, International Movies, Romantic Movies",A young woman talented at traditional dance finds her life changed when her love for a man clashes with the wishes of her father.
s7245,Movie,Kurt & Courtney,Nick Broomfield,"Kurt Cobain, Courtney Love",United Kingdom,"January 8, 2019",1998,R,95 min,"Documentaries, Music & Musicals","This film charts Nirvana's Kurt Cobain's rise to fame, his drug-addled romance with Courtney Love and the conspiracy theories surrounding his death."
s7247,Movie,Kurtulus Son Durak,Yusuf Pirhasan,"Belçim Bilgin, Demet Akbağ, Asuman Dabak, Ayten Soykök, Damla Sönmez, Mete Horozoğlu, Ahmet Mümtaz Taylan, Yavuz Bingöl, Hüseyin Soysalan, Tolga Karaçelik, Nihal Yalçın",Turkey,"March 10, 2017",2012,TV-MA,100 min,"Comedies, Dramas, International Movies","When a recently single psychologist moves to a new neighborhood, she finds friendship with women starting to rebel against years of domestic abuse."
s7248,Movie,Kya Kehna,Kundan Shah,"Preity Zinta, Saif Ali Khan, Anupam Kher, Farida Jalal, Chandrachur Singh",India,"April 1, 2018",2000,TV-PG,149 min,"Dramas, International Movies, Romantic Movies",A young university student's world is shaken after her brief involvement with a wealthy playboy results in her pregnancy.
s7249,Movie,Kygo: Live at the Hollywood Bowl,Devin Chanda,Kygo,United States,"March 12, 2018",2017,TV-MA,52 min,Music & Musicals,Join Norwegian electronic music superstar Kygo onstage and behind the scenes as he performs at the famed L.A. venue with a bevy of special guests.
s7250,Movie,Kyun! Ho Gaya Na,Samir Karnik,"Aishwarya Rai Bachchan, Vivek Oberoi, Amitabh Bachchan, Om Puri, Rati Agnihotri, Sunil Shetty, Tinnu Anand, Rahul Singh",India,"March 1, 2018",2004,TV-PG,165 min,"International Movies, Romantic Movies","Cinematic lovebirds Aishwarya Rai and Vivek Oberoi star in this love story about a sweet young girl, Diya, brought up by her widowed father on a coffee plantation in the village of Coorg."
s7251,Movie,La Última Fiesta,"Leandro Mark, Nicolás Silbert","Nicolás Vázquez, Alan Sabbagh, Benjamín Amadeo, Eva De Dominici, César Bordón, Julian Kartun, Paula Carruega, Luciano Rossi, Ezequiel Campa",Argentina,"February 1, 2017",2016,TV-MA,104 min,"Comedies, International Movies",Three best buddies are thrown into a wild chase for a priceless painting that was stolen from a house they used to throw a huge party.
s7252,Movie,LA 92,"Daniel Lindsay, T.J. Martin",,United States,"March 1, 2018",2017,R,114 min,Documentaries,Previously unseen footage is shaped into a fresh and timely retelling of the 1992 Rodney King trial – and the verdict that sparked civil unrest.
