show_id,type,title,director,cast,country,date_added,release_year,rating,duration,listed_in,description
s6272,Movie,Bedtime Stories,Adam Shankman,"Adam Sandler, Keri Russell, Guy Pearce, Russell Brand, Richard Griffiths, Jonathan Pryce, Courteney Cox, Lucy Lawless, Teresa Palmer, Aisha Tyler, Laura Ann Kesling, Jackie Sandler, Lorna Scott, Dana Min Goodman, Andrew Collins, Jonathan Loughran, Jonathan Morgan Heit, Nick Swardson, Tim Herlihy, Billy Tyler, Johntae Lipscomb, Mikey Post, Sebastian Saraceno, Bill Romanowski, Sadie Sandler, Carmen Electra, Allen Covert, Kathryn Joosten, Annalise Basso, Blake Clark, Julia Lea Wolov, Sarah G. Buxton",United States,"March 5, 2019",2008,PG,100 min,"Children & Family Movies, Comedies",Skeeter's life is turned upside down when the fantastical stories he makes up to entertain his niece and nephew inexplicably turn into reality.
s6273,Movie,Before the Flood,Fisher Stevens,Leonardo DiCaprio,United States,"February 1, 2018",2016,PG,97 min,Documentaries,Leonardo DiCaprio crisscrosses the globe to investigate the consequences of man-made globe warming and the measures being taken to reverse it.
s6274,Movie,"Behind ""The Cove"": The Quiet Japanese Speak Out",Keiko Yagi,,"Japan, United States","August 25, 2017",2015,TV-14,105 min,"Documentaries, International Movies","After a documentary about the Japanese whaling industry garnered international attention, an amateur filmmaker decides to tell the rest of the story."
s6275,Movie,Behind the Curtain: Todrick Hall,Katherine Fairfax Wright,Todrick Hall,United States,"April 5, 2018",2017,TV-MA,100 min,"Documentaries, LGBTQ Movies, Music & Musicals",Follow singer and YouTube sensation Todrick Hall as he launches an original musical based on growing up gay in Texas and finding showbiz success.
s6278,Movie,Beiimaan Love,Rajeev Chaudhari,"Sunny Leone, Rajneesh Duggal, Rajeev Verma, Daniel Weber, Yuvraj Siddharth Singh, Ziesha Nancy",India,"November 1, 2017",2016,TV-MA,115 min,"Dramas, International Movies, Romantic Movies","After having her heart broken by a man who seduced her at a party, a young, ambitious woman concocts a scheme to get revenge."
s6279,Movie,Being AP,Anthony Wonke,Tony McCoy,United Kingdom,"August 15, 2016",2015,TV-14,99 min,"Documentaries, International Movies, Sports Movies","With retirement staring him in the face, an all-time-great jump jockey pursues his 20th consecutive title in his unrelenting quest for glory."
s6281,Movie,Below Her Mouth,April Mullen,"Erika Linder, Natalie Krill, Sebastian Pigott, Mayko Nguyen, Tommie-Amber Pirie, Melanie Leishman, Andrea Stefancikova, Daniela Barbosa",Canada,"August 1, 2017",2016,TV-MA,91 min,"Dramas, Independent Movies, International Movies",An engaged fashion editor begins a torrid affair with a female roofer that threatens to turn both of their lives upside down.
s6283,Movie,Beneath the Leaves,Adam Marino,"Mira Sorvino, Kristoffer Polaha, Doug Jones, Paul Sorvino, Aaron Farb, Ser'Darius Blain, Christopher Backus, Christopher Masterson, Tommy Kijas, Kee Seymore, Marla Adams",United States,"June 8, 2019",2019,TV-MA,90 min,"Independent Movies, Thrillers","An escaped psychopathic child killer faces off against one of his former victims, who has since become a hard-nosed detective."
s6284,Movie,Benji: Off the Leash,Joe Camp,"Nick Whitaker, Chris Kendrick, Randall Newsome, Duane Stephens, Lincoln Hoppe, Christy Summerhays, Scott Wilkinson",United States,"March 6, 2018",2004,PG,100 min,"Children & Family Movies, Dramas","Benji is back in this charming story that's told from the pooch's point of view, tracking his early days as a pup to his current life in showbiz."
s6285,Movie,Benji's Very Own Christmas Story,Joe Camp,"Ron Moody, Patsy Garrett, Cynthia Smith",United States,"October 3, 2018",1978,TV-G,25 min,Children & Family Movies,"While on a press tour, Benji goes behind the scenes of Santa's workshop. But Santa has a devastating secret, so it's up to Benji to save Christmas."
s6286,Movie,Berlin Kaplani,Hakan Algül,"Ata Demirer, Necati Bilgiç, Tarık Ünlüoğlu, Özlem Türkad, Nihal Yalçın, Cemil Özbayer, Cengiz Bozkurt, Orhan Güner, Mert Aran",Turkey,"March 10, 2017",2012,TV-14,99 min,"Comedies, International Movies, Sports Movies","After a losing streak puts him in debt of 50,000 euros to his sponsors, an unlikely Turkish-German boxer in Berlin finds himself in need of a miracle."
s6287,Movie,"Berlin, I Love You",,,Germany,"June 8, 2019",2019,R,120 min,"Dramas, International Movies, Romantic Movies","Set in the Grey City, this ""Cities of Love"" installment is a star-studded, 10-story collection of redemptive love, crushing loss and everyday romances."
s6288,Movie,Best Neighbors,Tamer Bassiouni,"Sameh Hussain, Menna Arafa, Merna al-Mohandes",,"June 6, 2019",2014,TV-14,98 min,"Comedies, International Movies","A just-married couple moves into their new home, finding themselves at war with the kids next door, who seem determined to make their lives miserable."
s6289,Movie,Betting on Zero,Ted Braun,William Ackman,United States,"June 1, 2017",2017,TV-PG,104 min,Documentaries,"This documentary dives into the complex world of Herbalife, the international nutritional products company accused of being a pyramid scheme."
s6290,Movie,Bewafaa,Dharmesh Darshan,"Anil Kapoor, Akshay Kumar, Kareena Kapoor, Sushmita Sen, Shamita Shetty, Manoj Bajpayee, Kabir Bedi, Nafisa Ali, Supriya Pathak, Raj Premi, Supriya Karnik",India,"July 21, 2019",2005,TV-PG,149 min,"Dramas, International Movies, Romantic Movies","A young woman faces pressure to marry her brother-in-law, after her sister dies while giving birth. But she's secretly in love with someone else."
s6291,Movie,Bewildered Bolbol,Khaled Marei,"Ahmed Helmy, Zeina, Shery Adel, Emy Samir Ghanim, Yousef Fawzy, Yasser El Tobgy, Wael Sami, Maryam Saleh",Egypt,"June 20, 2019",2010,TV-14,112 min,"Comedies, International Movies, Romantic Movies",A man suffering from amnesia can't seem to choose between the women playing tricks on him.
s6293,Movie,Beyond All Boundaries,Sushrut Jain,Kunal Nayyar,"United States, India","April 1, 2017",2013,TV-14,98 min,"Documentaries, International Movies, Sports Movies","As the 2011 Cricket World Cup begins, three Indians demonstrate their passion and the sacrifices they've made for the country's most popular sport."
s6294,Movie,Beyond the Clouds,Majid Majidi,"Ishaan Khattar, Malavika Mohanan, Goutam Ghose, Sharada, Tannishtha Chatterjee, Shashank Shende, Hema Singh, Akash Gopal","India, Iran","August 10, 2018",2018,TV-14,120 min,"Dramas, Independent Movies, International Movies",A youthful drug dealer in Mumbai must change his ways when the sister who raised him is assaulted by her boss and imprisoned for defending herself.
s6297,Movie,Bhagam Bhag,Priyadarshan,"Akshay Kumar, Govinda, Lara Dutta, Paresh Rawal, Rajpal Yadav, Jackie Shroff, Arbaaz Khan, Tanushree Dutta, Asrani, Shakti Kapoor",India,"December 31, 2019",2006,TV-14,151 min,"Comedies, International Movies, Romantic Movies","A theater group lands in trouble when its new actress takes her own life, two of its members are framed for murder and no one is who they appear to be."
s6298,Movie,Bheemayan,Rajiv Chilaka,,,"May 10, 2019",2018,TV-Y,63 min,Children & Family Movies,"It's Diwali! To celebrate, Chhota Bheem and his friends put on a stage show of the Ramayana, re-enacting the epic story behind the festival of lights."
s6299,Movie,Bhool Bhulaiyaa,Priyadarshan,"Akshay Kumar, Vidya Balan, Ameesha Patel, Shiney Ahuja, Paresh Rawal, Rajpal Yadav, Manoj Joshi, Asrani, Vikram Gokhale, Rasika Joshi",India,"October 22, 2017",2007,TV-14,148 min,"Dramas, International Movies, Thrillers","Siddharth dismisses warnings that his palace might be haunted, until ghostly occurrences force him to reconsider his beliefs."
s6300,Movie,Bhoot,Ram Gopal Varma,"Ajay Devgn, Urmila Matondkar, Nana Patekar, Rekha, Fardeen Khan, Victor Banerjee, Tanuja, Seema Biswas",India,"December 31, 2019",2003,TV-MA,114 min,"Horror Movies, International Movies, Thrillers","After a couple moves into an apartment, the wife’s increasingly disturbing behavior unravels chilling secrets about their new home’s past."
s6301,Movie,Bhouri,Jasbir Bijendra Bhati,"Raghuvir Yadav, Masha Paur, Mohan Joshi, Manoj Joshi, Mukesh Tiwari, Shakti Kapoor, Sitaram Panchal, Kunika Lall",India,"December 1, 2017",2017,TV-14,123 min,"Dramas, Independent Movies, International Movies",A 23-year-old girl who's married to a man more than twice her age is forced to contend with the predatory nature of a male-dominated society.
s6303,Movie,Big Bear,Joey Kern,"Joey Kern, Adam Brody, Zachary Knighton, Tyler Labine, Pablo Schreiber, Toby Huss, Heidi Heaslet, Ahna O'Reilly",United States,"February 28, 2018",2017,TV-MA,87 min,Comedies,The alcohol-fueled high jinks of a bachelor party go haywire when the buddies of an ill-fated groom abduct his fiancée's new lover.
s6304,Movie,Big Daddy,Dennis Dugan,"Adam Sandler, Joey Lauren Adams, Jon Stewart, Cole Sprouse, Dylan Sprouse, Josh Mostel, Leslie Mann, Allen Covert, Rob Schneider, Kristy Swanson",United States,"October 1, 2020",1999,PG-13,93 min,Comedies,"Dumped by his girlfriend because he refuses to accept responsibility, overgrown adolescent Sonny Koufax adopts a 5-year-old to prove he's a grownup."
s6306,Movie,Big Fat Liar,Shawn Levy,"Frankie Muniz, Paul Giamatti, Amanda Bynes, Amanda Detmer, Donald Faison, Sandra Oh, Russell Hornsby, Michael Bryan French, Christine Tucci, Lee Majors, John Cho","United States, Germany","January 15, 2020",2002,PG,88 min,"Children & Family Movies, Comedies",Junior high students Jason and Kaylee take action when a greedy Hollywood producer turns Jason's essay into a hit film without giving him credit.
s6307,Movie,Big Kill,Scott Martin,"Christoph Sanders, Jason Patric, Clint Glenn Hummel, Lou Diamond Phillips, Danny Trejo, Scott Martin, Elizabeth McLaughlin, Stephanie Beran, K.C. Clyde, Michael Paré",United States,"June 18, 2019",2018,R,126 min,Action & Adventure,A tenderfoot and two gamblers seeking their fortunes in a boom town instead find themselves defending it from a gunslinging preacher and his gang.
s6308,Movie,Big Time,Kaspar Astrup Schröder,Bjarke Ingels,Denmark,"April 1, 2018",2017,TV-MA,90 min,Documentaries,"In this documentary, architect Bjarke Ingels offers his vision for 2 World Trade Center as he aims to restore Manhattan's skyline to its former glory."
s6309,Movie,Bigger Fatter Liar,Ron Oliver,"Ricky Garcia, Jodelle Ferland, Barry Bostwick, Fiona Vroom, Kevin O'Grady, Karen Holness",United States,"April 18, 2017",2017,PG,95 min,"Children & Family Movies, Comedies","When his video game concept is stolen by a dishonest executive, a teenage chronic liar sets out to prove that he's telling the truth, for once."
s6310,Movie,Biggie & Tupac,Nick Broomfield,Nick Broomfield,United Kingdom,"January 26, 2019",2002,R,108 min,"Documentaries, Music & Musicals","British documentarian Nick Broomfield investigates the murders of rappers Tupac Shakur and Biggie Smalls, digging up some surprises in the process."
s6311,Movie,Bill Burr: Let It Go,Shannon Hartman,Bill Burr,United States,"November 10, 2017",2010,NR,65 min,Stand-Up Comedy,"The musings of comedian Bill Burr are let loose in this special, which was filmed at the historic Fillmore Auditorium in San Francisco."
s6312,Movie,Billy Elliot,Stephen Daldry,"Jamie Bell, Gary Lewis, Stuart Wells, Billy Fane, Colin MacLachlan, Nicola Blackwell, Carol McGuigan, Joe Renton, Janine Birkett, Charlie Hardwick, Mike Elliot, Jean Heywood, Jamie Draven, Julie Walters, Trevor Fox, Adam Cooper","United Kingdom, France","February 1, 2019",2000,R,110 min,"Dramas, Independent Movies, International Movies","When a boy trades boxing school for ballet lessons, he may take his newfound talent all the way to the top - and win over his disapproving father."
s6313,Movie,Billy Graham: An Extraordinary Journey,"Vonda Harrell, Daniel Camenisch","Billy Graham, Jeff Hoyt, Tom Brokaw, Greta Van Susteren, Diane Sawyer, Larry King, George Bush Sr., George W. Bush, Bill Clinton, Franklin Graham",United States,"February 28, 2019",2018,TV-PG,66 min,"Documentaries, Faith & Spirituality",This documentary recounts the life story of evangelist preacher Billy Graham featuring interviews with family members and former presidents.
s6314,Movie,Bilu Rakkhosh,Indrasis Acharya,"Joy Sengupta, Koneenica Banerjee, Kanchana Moitra, Pradip Mukherjee",India,"March 15, 2018",2017,TV-MA,127 min,"Dramas, International Movies","Torn between his demanding corporate career, his passion for music and his turbulent family life, a man struggles to keep his inner demons in check."
s6315,Movie,Bioscope,"Gajendra Ahire, Viju Mane, Girish Mohite, Ravi Jadhav","Nina Kulkarni, Suhas Palshikar, Kushal Badrike, Spruha Joshi, Mangesh Desai, Smita Tambe, Veena Jamkar, Sandeep Khare",India,"August 15, 2018",2015,TV-14,131 min,"Dramas, International Movies, LGBTQ Movies","Inspired by classic and contemporary literature, four renowned Marathi directors create four individual stories in this anthology of short films."
s6316,Movie,Birthmarked,Emanuel Hoss-Desmarais,"Toni Collette, Matthew Goode, Andreas Apergis, Michael Smiley, Fionnula Flanagan, Suzanne Clément, Jordan Poole, Megan O'Kelly, Anton Gillis-Adelman, Tyrone Benskin, Vincent Hoss-Desmarais",Canada,"June 28, 2018",2018,TV-MA,88 min,"Comedies, Independent Movies, International Movies","In an attempt to settle the ""nature vs. nurture"" debate, a scientist couple raises three children to live lives that defy their genetic dispositions."
s6317,Movie,Bitch,Marianna Palka,"Jason Ritter, Jaime King, Marianna Palka, Brighton Sharbino, Rio Mangini, Jason Maybaum, Kingston Foster, Arielle Kebbel, Martin Starr, Roger Guenveur Smith, Caroline Aaron, Bill Smitrovich",United States,"March 11, 2018",2017,R,97 min,"Comedies, Dramas, Independent Movies","Cracking under the demands of children and a philandering, thankless husband, an overworked suburban mother assumes the persona of a ferocious dog."
s6318,Movie,Bitcoin Heist,Ham Tran,"Kate Nhung, Thanh Pham, Petey Majik Nguyen, Suboi, Jayvee Mai The Hiep, Lam Thanh My",Vietnam,"September 2, 2017",2016,TV-14,116 min,"Action & Adventure, Comedies, International Movies","A unconventional, efficient Interpol special agent goes rogue and assembles a team of thieves to catch a shadowy hacker called ""The Ghost."""
s6321,Movie,Bittoo Boss,Supavitra Babul,"Pulkit Samrat, Ashok Pathak, Tanvir Singh, Amita Pathak, Sunil Shetty, Rajendra Sethi, Mohan Kapoor",India,"July 5, 2020",2012,TV-14,117 min,"Comedies, Dramas, International Movies","When a small-town wedding videographer falls in love, he decides he needs to make more money and turns to shooting sexy videos – with mixed results."
s6322,Movie,Black & Privileged: Volume 1,Mark Harris,"Dawnisha Halfkenny, Simeon Henderson, Corey Hendrix, Malcom Banks, Nadia Simms, Brian White, Brely Evans, Cynda Williams, Carl Anthony Payne II",United States,"July 12, 2019",2019,TV-MA,79 min,Dramas,"When low-income families move into a thriving black community in Chicago, they find themselves at odds with politicians to maintain their status."
s6323,Movie,Black Hawk Down,Ridley Scott,"Josh Hartnett, Ewan McGregor, Tom Sizemore, Eric Bana, William Fichtner, Ewen Bremner, Sam Shepard, Gabriel Casseus, Kim Coates, Hugh Dancy, Ron Eldard, Ioan Gruffudd, Tom Guiry, Charlie Hofheimer, Danny Hoch, Jason Isaacs, Zeljko Ivanek, Glenn Morshower, Jeremy Piven, Brendan Sexton III","United States, United Kingdom","January 1, 2019",2001,R,144 min,"Action & Adventure, Dramas","When U.S. forces attempt to capture two underlings of a Somali warlord, their helicopters are shot down and the Americans suffer heavy casualties."
s6325,Movie,Black Man White Skin,Jose Manuel Colón,,Spain,"June 1, 2016",2015,TV-PG,79 min,"Documentaries, International Movies",This film chronicles the health and social problems that African albinos face and details the fight waged on their behalf by advocacy groups in Spain.
s6326,Movie,Black Panther,Ryan Coogler,"Chadwick Boseman, Michael B. Jordan, Lupita Nyong'o, Danai Gurira, Martin Freeman, Daniel Kaluuya, Letitia Wright, Winston Duke, Sterling K. Brown, Angela Bassett, Forest Whitaker, Andy Serkis, Florence Kasumba, John Kani, David S. Lee, Stan Lee",United States,"September 4, 2018",2018,PG-13,135 min,"Action & Adventure, Sci-Fi & Fantasy","T'Challa, the superpowered new leader of the hidden, highly advanced African nation of Wakanda, strives to protect his home from enemies old and new."
s6327,Movie,Black Site Delta,Jesse Gustafson,"Cam Gigandet, Teri Reeves, Michael Dale, Dion Mucciacito, Casey Hendershot, Benjamin Charles Watson, John Brodsky, Arash Mokhtar",United States,"August 9, 2017",2017,TV-MA,88 min,Action & Adventure,"After discovering that their secret military prison is under attack by terrorists, a ragtag group of inmates does their best to neutralize the enemy."
s6328,Movie,Black Snake Moan,Craig Brewer,"Samuel L. Jackson, Christina Ricci, Justin Timberlake, S. Epatha Merkerson, John Cothran, David Banner, Michael Raymond-James, Adriane Lenox, Kim Richards, Neimus K. Williams",United States,"November 20, 2019",2007,R,116 min,"Dramas, Independent Movies","Lazarus finds Rae beaten and near death, and acts as a father figure to help redeem her. But before saving anyone, Lazarus must face his own demons."
s6329,Movie,Black Snow,Martin Hodara,"Ricardo Darín, Leonardo Sbaraglia, Laia Costa, Federico Luppi, Dolores Fonzi, Andrés Herrera","Argentina, Spain","July 1, 2017",2017,TV-MA,91 min,"Dramas, International Movies, Thrillers",An old tragedy and lingering animosity erupt when a man returns to Patagonia to convince his estranged brother to sell the family's isolated property.
s6330,Movie,Blackfish,Gabriela Cowperthwaite,,United States,"May 1, 2020",2013,PG-13,83 min,Documentaries,"This fascinating documentary examines the life of performing killer whale Tilikum, who has caused the deaths of several people while in captivity."
s6331,Movie,Blackway,Daniel Alfredson,"Anthony Hopkins, Julia Stiles, Alexander Ludwig, Ray Liotta, Hal Holbrook, Lochlyn Munro, Steve Bacic, Aaron Pearl, Aleks Paunovic",United States,"December 15, 2017",2015,PG-13,90 min,Thrillers,"Menaced by a psychopath who's got the local cops scared, waitress Lillian turns to a mysterious old logger to help her turn the tables on her stalker."
s6332,Movie,Blaze,Ethan Hawke,"Benjamin Dickey, Alia Shawkat, Josh Hamilton, Charlie Sexton, Sam Rockwell, Wyatt Russell, Steve Zahn, Kris Kristofferson, Richard Linklater, David Kallaway, Ritchie Montgomery",United States,"August 30, 2020",2018,R,129 min,"Dramas, Independent Movies, Music & Musicals","An influential, if unsung country songwriter reflects on his career, and how the love of his life drove him to write his most personal music."
s6333,Movie,Bleed for This,Ben Younger,"Miles Teller, Aaron Eckhart, Katey Sagal, Ciarán Hinds, Ted Levine, Jordan Gelber, Amanda Clayton, Daniel Sauli, Christine Evangelista, Tina Casciani",United States,"April 11, 2020",2016,R,120 min,"Dramas, Sports Movies","After a devastating injury derails his career, scrappy world champion boxer Vinny Pazienza determines to make an against-all-odds comeback."
s6334,Movie,Blinky Bill: The Movie,Deane Taylor,"Ryan Kwanten, Rufus Sewell, Toni Collette, Robin McLeavy, David Wenham, Barry Humphries, Richard Roxburgh, Deborah Mailman, Barry Otto","Australia, United States","February 8, 2017",2015,PG,91 min,Children & Family Movies,Happy koala Blinky Bill and some spunky pals travel the Outback following clues to help him find his long-lost father and finally bring him home.
s6335,Movie,Blockbuster,July Hygreck,"Syrus Shahidi, Lionel Abelanski, Charlotte Gabris, Tom Hygreck, Sylvain Quimene, Laura Boujenah, Foed Amara",France,"January 24, 2018",2017,TV-MA,85 min,"Comedies, Independent Movies, International Movies","Dumped over a video he made to amuse his ailing dad, a heartsick Jérémy hatches an elaborate scheme to win back his superhero-loving girlfriend, Lola."
s6337,Movie,Blood Father,Jean-François Richet,"Mel Gibson, Erin Moriarty, Diego Luna, Michael Parks, William H. Macy, Miguel Sandoval, Dale Dickey, Richard Cabral, Daniel Moncada, Ryan Dorsey",France,"March 26, 2020",2016,R,88 min,"Action & Adventure, International Movies",An ex-convict and estranged father finds the chance to prove himself when his daughter seeks his help shaking off a dangerous group of drug dealers.
s6338,Movie,Blow,Ted Demme,"Johnny Depp, Penélope Cruz, Franka Potente, Rachel Griffiths, Paul Reubens, Jordi Mollà, Cliff Curtis, Miguel Sandoval, Ethan Suplee, Ray Liotta",United States,"October 1, 2019",2001,R,123 min,Dramas,Cocaine smuggler George rises from poverty to become one of the biggest drug dealers in America before his eventual downfall.
s6339,Movie,Blue Is the Warmest Color,Abdellatif Kechiche,"Léa Seydoux, Adèle Exarchopoulos, Salim Kechiouche, Aurélien Recoing, Catherine Salée, Benjamin Siksou, Mona Walravens, Alma Jodorowsky, Jérémie Laheurte, Anne Loiret, Benoît Pilot, Sandor Funtek, Fanny Maurin","France, Belgium, Spain","August 26, 2016",2013,NC-17,180 min,"Dramas, Independent Movies, International Movies","Determined to fall in love, 15-year-old Adele is focused on boys. But it's a blue-haired girl she meets on the street who really piques her interest."
s6340,Movie,Blue Jasmine,Woody Allen,"Cate Blanchett, Sally Hawkins, Alec Baldwin, Louis C.K., Bobby Cannavale, Andrew Dice Clay, Peter Sarsgaard, Michael Stuhlbarg, Tammy Blanchard, Max Casella, Alden Ehrenreich",United States,"March 8, 2019",2013,PG-13,98 min,"Comedies, Dramas, Independent Movies",The high life leads to high anxiety for a fashionable New York City homemaker in crisis who finds herself forced to live a more modest lifestyle.
s6341,Movie,Blue Mountain State: The Rise of Thadland,Lev L. Spiro,"Alan Ritchson, Darin Brooks, James Cade, Rob Ramsay, Chris Romano, Frankie Shaw, Omari Newton, Ed Marinaro, Dhani Jones, Ed Amatrudo, Jimmy Tatro",United States,"March 1, 2016",2016,R,90 min,Comedies,"New NFL star Thad buys his old teammates' beloved frat house, renames it Thadland and throws the raunchiest, most debauched party in school history."
s6343,Movie,Blue Ruin,Jeremy Saulnier,"Macon Blair, Devin Ratray, Amy Hargreaves, Kevin Kolack, Eve Plumb, David W. Thompson, Brent Werzner, Stacy Rock, Sidné Anderson, Sandy Barnett, Bonnie Johnson","United States, France","February 25, 2019",2013,R,90 min,"Independent Movies, Thrillers","Bad news from the past unhinges vagabond Dwight Evans, sending him on a mission of bloody retribution that takes him to his childhood hometown."
s6344,Movie,Blue Streak,Les Mayfield,"Martin Lawrence, Luke Wilson, Peter Greene, Dave Chappelle, Nicole Ari Parker, Graham Beckel, Robert Miranda, Olek Krupa, Saverio Guerra, Richard C. Sarafian, William Forsythe","Germany, United States","January 1, 2021",1999,PG-13,94 min,"Action & Adventure, Comedies",A jewel thief returns to his hiding place after a stint in jail — only to find that his diamond is buried under a newly constructed police station.
s6345,Movie,Blue Valentine,Derek Cianfrance,"Ryan Gosling, Michelle Williams, Faith Wladyka, John Doman, Mike Vogel, Ben Shenkman, Jen Jones, Maryann Plunkett, Marshall Johnson, James Benatti, Barbara Troy, Carey Westbrook, Enid Graham",United States,"July 5, 2018",2010,R,112 min,"Dramas, Independent Movies, Romantic Movies","As Cindy and Dean muddle through their languishing marriage, they hearken back to the golden days when life was filled with possibility and romance."
s6346,Movie,Blurred Lines: Inside the Art World,Barry Avrich,,Canada,"December 31, 2017",2017,TV-MA,85 min,Documentaries,Artists and industry insiders shed light on the commercial forces behind the veneer of genius and glamour that often shrouds contemporary art.
s6347,Movie,Bob Lazar: Area 51 & Flying Saucers,Jeremy Kenyon Lockyer Corbell,Robert Lazar,United States,"June 18, 2019",2018,TV-MA,97 min,Documentaries,"Decades ago, Bob Lazar blew the whistle on Area 51. Now he’s back to explain the alien tech he worked with, and the government's war to shut him up."
s6349,Movie,Bob's Broken Sleigh,Jay Surridge,"Cole Howard, Bruce Greenwood, Victor Garber, Michael Adamthwaite, Raini Rodriguez, Colin Murdock, Maryke Hendrikse, Sam Vincent, Gabe Khouth",Canada,"December 17, 2015",2015,TV-G,47 min,Children & Family Movies,"An overly eager elf improves Santa's sleigh, but when he crash lands far from home, three odd critters pitch in to send him back to the North Pole."
s6350,Movie,Bobbi Jene,Elvira Lind,Bobbi Jene Smith,"Denmark, Sweden, Israel, United States","June 1, 2018",2017,TV-MA,99 min,Documentaries,This candid profile follows dancer Bobbi Jene Smith as she leaves the company of Israeli choreographer Ohad Naharin to forge her own artistic path.
s6351,Movie,Bobby,Raj Kapoor,"Rishi Kapoor, Dimple Kapadia, Pran, Prem Nath, Sonia Sahni, Durga Khote, Aruna Irani, Prem Chopra, Farida Jalal",India,"December 31, 2019",1973,TV-14,168 min,"Classic Movies, Dramas, International Movies","Raj, the son of strict, wealthy parents, falls in love with Bobby, the daughter of a poor Christian fisherman – a romance his parents oppose."
s6352,Movie,Bobby Robson: More Than a Manager,"Gabriel Clarke, Torquil Jones",Bobby Robson,United Kingdom,"December 1, 2018",2018,TV-14,99 min,"Documentaries, International Movies, Sports Movies","Explore the life and times of legendary soccer manager Bobby Robson, whose keen mind for the game was matched only by his devotion to his teams."
s6353,Movie,Bobby Sands: 66 Days,Brendan Byrne,,"Ireland, United Kingdom","September 28, 2017",2016,TV-14,106 min,Documentaries,"In 1981, an imprisoned Irish Republican Army soldier went on a hunger strike that galvanized his movement and made him a controversial global icon."
