show_id,type,title,director,cast,country,date_added,release_year,rating,duration,listed_in,description
s6532,Movie,Convict,Abdul Aziz Hashad,"Bassem Samra, Ahmad Wafiq, Ahmed Azmy, Dina Fouad, Mohamed Sharaf, Ahmed Rateb, Maha Sabry, Diaa El Merghany, Inas Ezz El Din, Said Tarabeek",,"June 13, 2019",2014,TV-14,97 min,"Dramas, International Movies","Sentenced to death for committing rape, a convict navigates his final trying days alongside his allies and enemies in prison."
s6534,Movie,Cool Hand Luke,Stuart Rosenberg,"Paul Newman, George Kennedy, J.D. Cannon, Lou Antonio, Robert Drivas, Strother Martin, Jo Van Fleet, Harry Dean Stanton, Dennis Hopper, Joe Don Baker, James Gammon, Wayne Rogers",United States,"January 1, 2021",1967,TV-14,127 min,"Classic Movies, Dramas","Luke Jackson likes to do things his own way, which leads to a world of hurt when he ends up in a prison camp – and on the wrong side of its warden."
s6535,Movie,Cop and a Half: New Recruit,Jon Rosenbaum,"Lou Diamond Phillips, Lulu Wilson, Giles Panton, Janet Kidder, Michael Coleman, Wallace Shawn, Gina Holden, Jordyn Ashley Olson, Vincent Tong, Reese Alexander",Canada,"August 17, 2017",2017,PG,96 min,"Children & Family Movies, Comedies",A world-weary detective is forced to team up with a 12-year-old who thinks she's a cop in order to solve a case that's baffled police.
s6536,Movie,Cop Watchers,Ben Steele,,,"August 1, 2017",2016,TV-MA,45 min,"Documentaries, International Movies",Explore the stories of the citizens who seek to deter police brutality by observing and videotaping arrests made by the New York Police Department.
s6537,Movie,Coraline,Henry Selick,"Dakota Fanning, Teri Hatcher, John Hodgman, Jennifer Saunders, Dawn French, Keith David, Robert Bailey Jr., Ian McShane",United States,"March 16, 2017",2009,PG,101 min,Children & Family Movies,Curious young Coraline unlocks a door in her family's home and is transported to a universe that strangely resembles her own – only better.
s6538,Movie,Counterfeiting in Suburbia,Jason Bourque,"Sarah Butler, Larissa Albuquerque, Kayla Wallace, Matthew MacCaull, James Dean, Alison Wandzura, Bruce Blain, Natalie Grace, Phillip Mitchell",Canada,"July 1, 2018",2018,TV-14,88 min,"Dramas, Thrillers","Two teenagers print counterfeit money in their high school art room, but things go terribly wrong when their debt-ridden teacher becomes suspicious."
s6540,Movie,Covered: Alive in Asia,"Micah Bickham, Galley Molina",Israel Houghton,United States,"March 31, 2016",2016,TV-G,75 min,"Documentaries, Faith & Spirituality, Music & Musicals","Christian musician Israel Houghton leads his band Israel & New Breed on a tour supporting their newest album of multicultural, hybrid-genre songs."
s6541,Movie,Crash,Paul Haggis,"Sandra Bullock, Don Cheadle, Matt Dillon, Jennifer Esposito, William Fichtner, Brendan Fraser, Terrence Howard, Ludacris, Thandie Newton, Ryan Phillippe, Larenz Tate, Nona Gaye, Michael Peña","United States, Germany","October 1, 2019",2004,R,112 min,"Dramas, Independent Movies","In post-Sept. 11 Los Angeles, tensions erupt when the lives of people from all walks of life converge during a 36-hour period."
s6542,Movie,CRD,Kranti Kanade,"Mrinmayee Godbole, Vinay Sharma, Saurabh Saraswat, Isha Keskar, Abhay Mahajan, Geetika Tyagi",India,"April 29, 2019",2016,TV-MA,110 min,"Comedies, Dramas, Independent Movies","At odds with his radical instructor's ruthless methods, a drama student assembles his own troupe of misfit actors ahead of a prestigious competition."
s6544,Movie,"Crouching Tiger, Hidden Dragon",Ang Lee,"Chow Yun Fat, Michelle Yeoh, Zhang Ziyi, Chang Chen, Lung Hsiung, Cheng Pei-pei, Fa Zeng Li, Xian Gao, Yan Hai, De Ming Wang","Taiwan, Hong Kong, United States, China","March 1, 2019",2000,PG-13,120 min,"Action & Adventure, International Movies, Romantic Movies",A young woman in ancient China longs for an adventurous life rather than a dull arranged marriage in Ang Lee's Oscar-winning martial arts epic.
s6545,Movie,Cult of Chucky,Don Mancini,"Fiona Dourif, Michael Therriault, Adam Hurtig, Alex Vincent, Jennifer Tilly, Brad Dourif, Summer H. Howell, Grace Lynn Kung, Elisabeth Rosen, Zak Santiago, Ali Tataryn",United States,"October 3, 2017",2017,R,90 min,Horror Movies,"Following a string of murders in the asylum where she's confined, Nica Pierce begins to wonder whether Chucky is real after all."
s6546,Movie,Cutie and the Boxer,Zachary Heinzerling,"Noriko Shinohara, Ushio Shinohara",United States,"June 14, 2018",2013,R,82 min,Documentaries,"A 2014 Oscar nominee for Best Documentary Feature, this film explores the symbiotic relationship of artists Ushio and Noriko Shinohara."
s6547,Movie,Daagdi Chaawl,Chandrakant Kanse,"Ankush Chaudhari, Makrand Deshpande, Pooja Sawant, Sanjay Khapre, Yatin Karyekar, Kamlesh Sawant, Sandeep Gaikwad, Digvijay Rohidas",India,"February 15, 2018",2015,TV-14,118 min,"Action & Adventure, Dramas, International Movies",A simple man's peaceful life is complicated when an incident brings him in contact with a gangster and launches his journey into the underworld.
s6548,Movie,Dabbe 6: The Return,Hasan Karacadağ,"Sema Şimşek, Nilay Gök, Volkan Ünal, Fehmi Karaarslan, Elçin Atamgüç, Ömer Duran, Murat Seviş, Aybike Turan, Burak Çimen",Turkey,"April 17, 2019",2015,TV-MA,153 min,"Horror Movies, International Movies","A cardiologist tries to pinpoint the cause of her mother's sudden death as her sister, who witnessed it, claims malevolent demons are at play."
s6549,Movie,Dad,Gary David Goldberg,"Jack Lemmon, Ted Danson, Olympia Dukakis, Kathy Baker, Kevin Spacey, Ethan Hawke, Zakes Mokae, J.T. Walsh, Peter Michael Goetz, John Apicella, Richard McGonagle, Bill Morey, Mary Fogarty",United States,"April 1, 2018",1989,PG,117 min,Dramas,"Family bonds are revived after a father is diagnosed with cancer in this bittersweet drama. Dutiful son John cares for his aging father, Jake, but not without complaint."
s6551,Movie,Daddy Day Care,Steve Carr,"Eddie Murphy, Jeff Garlin, Steve Zahn, Regina King, Anjelica Huston, Kevin Nealon, Jonathan Katz, Siobhan Fallon Hogan, Lisa Edelstein, Lacey Chabert, Laura Kightlinger, Leila Arcieri",United States,"January 1, 2019",2003,PG,93 min,"Children & Family Movies, Comedies","When a conscientious father loses his lucrative dot-com job and faces economic ruin, he joins two friends in opening a business called Daddy Day Care."
s6552,Movie,Daddy Issues,Amara Cash,"Madison Lawlor, Montana Manning, Andrew Pifko, Monte Markham, Kamala Jones, Jodi Carol Harrison, Seth Cassell, Ronnie Clark, Lissa Danshaw, J.J. Hawkins",United States,"September 20, 2019",2019,TV-MA,82 min,"Dramas, Independent Movies, LGBTQ Movies","Maya finally hooks up with her online dream girl, only to discover she’s deeply involved with an older sugar daddy – a man Maya knows all too well."
s6553,Movie,Daemonium,Pablo Parés,"Walter Cornás, Dany Casco, Caro Angus, Rocío Rodríguez Presedo, Chucho Fernández, Amanda Nara, Maite Zumelzú",Argentina,"December 20, 2016",2015,NR,115 min,"Action & Adventure, Horror Movies, International Movies","In a realm where magic and technology intersect, a shifty, cigar-smoking wizard finds himself in the middle of a war with the powers of hell."
s6554,Movie,Daffedar,Johnson Esthappan,"Tini Tom, Malavikka, Sudheer Karamana, Indrans",India,"July 1, 2018",2017,TV-14,151 min,"Dramas, International Movies","A retired government worker continues to dedicate himself to public service, but his principled ways soon clash with those of his extravagant sons."
s6555,Movie,Dagh Ujala,Raj Amit Kumar,"Victor Banerjee, Adil Hussain, Bhanu Uday, Preeti Gupta, Bhavani Lee, Ankur Vikal, Seema Rahmani, Samrat Chakrabarti","United States, India","April 1, 2018",2015,TV-MA,103 min,"Dramas, Independent Movies, International Movies",A lesbian daughter fights off an arranged marriage in India while an Islamic fundamentalist targets an anti-extremist Muslim scholar in New York.
s6556,Movie,Dallas Buyers Club,Jean-Marc Vallée,"Matthew McConaughey, Jennifer Garner, Jared Leto, Denis O'Hare, Steve Zahn, Michael O'Neill, Dallas Roberts, Griffin Dunne, Kevin Rankin, Donna DuPlantier",United States,"January 16, 2018",2013,R,117 min,"Dramas, Independent Movies, LGBTQ Movies","Refusing to accept a death sentence from his doctor after being diagnosed with AIDS in 1986, Ron Woodroof smuggles medications from abroad."
s6558,Movie,Dance Academy: The Comeback,Jeffrey Walker,"Xenia Goodwin, Alicia Banit, Dena Kaplan, Jordan Rodrigues, Keiynan Lonsdale, Thomas Lacey, Tara Morice, Miranda Otto","Germany, Australia","July 2, 2018",2017,TV-PG,100 min,"Dramas, International Movies","In this adaptation of the TV series, Tara recovers from injury and pursues a career in the U.S., where she grapples with love and professional rejection."
s6559,Movie,Dancing Quietly,Philipp Eichholtz,"Martina Schöne-Radunski, Hans-Heinrich Hardt, Sebastian Fräsdorf, Claudia Jacob, Deleila Piasko, Tobias Borchers, Ruth Bickelhaupt",Germany,"April 1, 2017",2016,TV-MA,70 min,"Dramas, Independent Movies, International Movies","After years of battling a deep depression, a young woman attempts to pass an important exam with the help of a fellow student."
s6562,Movie,Danny Says,Brendan Toller,"Danny Fields, Iggy Pop, Alice Cooper, Judy Collins, Tommy Ramone, Jac Holzman, Lenny Kaye, Wayne Kramer, John Cameron Mitchell, Jann Wenner",United States,"March 2, 2017",2015,TV-MA,103 min,"Documentaries, Music & Musicals","This documentary profiles eccentric publicist Danny Fields, who helped launch the careers of innovative new artists who would become musical icons."
s6563,Movie,Dante's Peak,Roger Donaldson,"Pierce Brosnan, Linda Hamilton, Elizabeth Hoffman, Jamie Renée Smith, Jeremy Foley, Charles Hallahan, Grant Heslov, Kirk Trutner, Arabella Field, Tzi Ma",United States,"September 1, 2019",1997,PG-13,108 min,Action & Adventure,"When a volcanologist comes to investigate the recent rumblings of a dormant volcano, a massive eruption has everyone in town fighting for their lives."
s6564,Movie,Dare to Be Wild,,,Ireland,"April 1, 2018",2015,TV-PG,100 min,"Dramas, Independent Movies, Romantic Movies",Irish landscape designer Mary Reynolds fights to bring her wild and unconventional style to the esteemed Chelsea Flower Show.
s6565,Movie,Dark Chocolate (Bengali Version),Agnidev Chatterjee,"Riya Sen, Mahima Chaudhry, Rajesh Sharma, Indrasish Roy, Mumtaz Sorcar, Sudip Mukherjee, Shataf Figar, Koushik Sen",India,"December 15, 2017",2016,TV-MA,91 min,"Dramas, International Movies, Thrillers","In this Bangla thriller inspired by a true story, the discovery of a charred corpse in the woods leads to a high-profile murder investigation."
s6566,Movie,Dark Crimes,Alexandros Avranas,"Jim Carrey, Marton Csokas, Charlotte Gainsbourg, Agata Kulesza, Kati Outinen, Zbigniew Zamachowski, Danuta Kowalska, Vlad Ivanov, Robert Więckiewicz, Piotr Głowacki","United Kingdom, Poland, United States","October 15, 2019",2016,R,93 min,"Dramas, Thrillers",A detective on a cold murder case discovers that a famous writer’s latest novel contains details chillingly similar to the crime he’s investigating.
s6567,Movie,Dark Places,Gilles Paquet-Brenner,"Charlize Theron, Nicholas Hoult, Chloë Grace Moretz, Tye Sheridan, Sterling Jerins, Corey Stoll, Christina Hendricks, Drea de Matteo, Sean Bridgers, Andrea Roth","United States, United Kingdom, France","July 26, 2018",2015,R,113 min,"Dramas, International Movies, Thrillers","Years after surviving a brutal crime as a child, Libby Day comes to believe that the brother she testified against for committing it may be innocent."
s6568,Movie,Darna Mana Hai,Prawal Raman,"Aftab Shivdasani, Antara Mali, Boman Irani, Isha Koppikar, Nana Patekar, Raghuvir Yadav, Rajpal Yadav, Revathy, Saif Ali Khan, Sameera Reddy, Sanjay Kapoor, Shilpa Shetty, Sohail Khan, Vivek Oberoi",India,"August 1, 2019",2003,TV-MA,116 min,"Horror Movies, International Movies, Thrillers","Stranded in a jungle when their car breaks down, six friends pass their time exchanging horror stories, unaware that they may be part of one themselves."
s6570,Movie,Darra,Parveen Kumar,"Gurpreet Ghuggi, Happy Raikoti, Kartar Cheema, Sardar Sohi, Shavendra Mahal, Karamjit Anmol, Pammi Bai, Nirmal Rishi, Manpreet Saggu",India,"October 15, 2017",2016,TV-14,121 min,"Dramas, International Movies","After returning from school and getting married, a popular farmer begins to arouse resentment and jealousy among those around him."
s6571,Movie,Daughters of the Dust,Julie Dash,"Cora Lee Day, Alva Rogers, Barbarao, Trula Hoosier, Adisa Anderson, Kaycee Moore, Bahni Turpin, Cheryl Lynn Bruce, Tommy Redmond Hicks, Cornell Royal","United Kingdom, United States","June 10, 2017",1991,NR,112 min,"Classic Movies, Dramas, Independent Movies",An African American Gullah family leaves their coastal island home in 1902 and risks losing their culture to start a new life on the U.S. mainland.
s6574,Movie,Dayveon,Amman Abbasi,"Devin Blackmon, Dontrell Bright, Kordell ""KD"" Johnson, Lachion Buckingham, Chasity Moore, Marquell Manning, Shavidee Trotter, Maurice Everett",United States,"January 11, 2018",2017,TV-MA,76 min,"Dramas, Independent Movies","Following the shooting death of his older brother, a depressed and aimless 13-year-old boy falls in with a gang in rural Arkansas."
s6575,Movie,De Film van Dylan Haegens,"Dylan Haegens, Bas van Teylingen","Dylan Haegens, Nick Golterman, Marit Brugman, Ilse Warringa, Teun Peters, Patrick Stoof, Rick Vermeulen, Rico Verhoeven",Netherlands,"April 17, 2019",2018,TV-PG,81 min,"Comedies, International Movies",A YouTuber becomes obsessed with figuring out how his copycat archnemesis manages to steal all of his ideas.
s6576,Movie,De Palma,"Noah Baumbach, Jake Paltrow",Brian De Palma,United States,"November 21, 2018",2015,R,110 min,Documentaries,"Iconoclastic film director Brian DePalma takes a look back at the production of such classic movies as ""Carrie,"" ""Scarface"" and ""The Untouchables."""
s6577,Movie,Dead in a Week (Or Your Money Back),Tom Edmunds,"Tom Wilkinson, Aneurin Barnard, Freya Mavor, Marion Bailey, Christopher Eccleston, Nigel Lindsay, Velibor Topic",United Kingdom,"March 1, 2019",2018,TV-MA,90 min,Comedies,"After several failed attempts at taking his own life, a young man hires an aging assassin who’ll do anything to fend off retirement."
s6578,Movie,Deadline: Sirf 24 Ghante,Tanveer Khan,"Irrfan Khan, Konkona Sen Sharma, Rajit Kapoor, Sandhya Mridul, Zakir Hussain, Rajeev Verma, Princey Shukla",India,"December 31, 2019",2006,TV-14,97 min,"Independent Movies, International Movies, Thrillers",A surgeon’s perfect life is rattled when his daughter is taken hostage in their own home and he's given 24 hours to pay a hefty ransom.
s6579,Movie,Deadly Scholars,Danny J. Boyle,"Kennedy Lea Slocum, Corey Fogelmanis, Alexa Mansour, Peyton Clark, Sheryl Lee, Sherri Saum, Eric Stanton Betts, Paris Berelc, Pedro Correa, Alissa Latow",United States,"February 15, 2019",2018,TV-14,86 min,"Dramas, Thrillers","After a series of strange deaths, a high school reporter tries to pin down the killer who's targeting students eligible for a prestigious scholarship."
s6580,Movie,Dean,Demetri Martin,"Demetri Martin, Kevin Kline, Gillian Jacobs, Rory Scovel, Ginger Gonzaga, Reid Scott, Mary Steenburgen, Briga Heelan, Christine Woods, Peter Scolari",United States,"March 15, 2020",2016,PG-13,94 min,"Comedies, Dramas, Independent Movies","As his father takes steps to move on, a New Yorker grieving his mom's death visits Los Angeles where new possibilities may bring him out of his funk."
s6581,Movie,Dear Dad,Tanuj Bhramar,"Arvind Swamy, Himanshu Sharma, Ekavali Khanna, Aman Uppal, Bhavika Bhasin",India,"March 2, 2019",2016,TV-14,83 min,"Comedies, Dramas, Independent Movies","A father and son bond on an impromptu road trip over deep conversations, unexpected confessions, strange encounters ... and a drunken escapade."
s6582,Movie,Dear Dracula,Chad Van De Keere,"Nathan Gamble, Ray Liotta, Emilio Estevez, Ariel Winter, Matthew Lillard, Yuri Lowenthal, Marion Ross, Tara Strong",United States,"February 18, 2016",2012,TV-Y7-FV,43 min,"Children & Family Movies, Comedies","When he gets a fan letter from a young monster movie buff, Dracula visits him and soon has a new friend helping him to get his confidence back."
s6583,Movie,Dear Santa,Jason Priestley,"Amy Acker, David Haydn-Jones, Patrick Creery, Gina Holden, James Dugan, Margherita Donato, Brooklynn Proulx, James D. Hopkin, Bob Irvine",Canada,"November 4, 2019",2011,TV-PG,92 min,"Comedies, Romantic Movies","Finding a letter mailed to Santa by a girl asking for a new wife for her daddy, twentysomething Crystal sets out to make the girl's wishes come true."
s6584,Movie,Death at a Funeral,Neil LaBute,"Chris Rock, Martin Lawrence, Tracy Morgan, Danny Glover, James Marsden, Luke Wilson, Zoe Saldana, Regina Hall, Columbus Short, Peter Dinklage, Kevin Hart, Loretta Devine, Regine Nehy, Keith David, Ron Glass",United States,"August 1, 2020",2010,R,93 min,Comedies,"When a Los Angeles family's patriarch dies, his dutiful eldest son plans the funeral – which becomes a fiasco thanks to a colorful cast of attendees."
s6585,Movie,Death House,Harrison Smith,"Cody Longo, Cortney Palm, Adrienne Barbeau, Michael Berryman, Barbara Crampton, Sid Haig, Gunnar Hansen, Lindsay Hartley, Kane Hodder, Lloyd Kaufman, Camille Keaton, Bill Moseley, Tony Todd, Dee Wallace, Vincent Ward, Vernon Wells",United States,"May 5, 2019",2017,R,88 min,Horror Movies,Two federal agents battle through an army of rioting prisoners – and their sense of reality – inside a high-tech prison modeled after Dante’s Inferno.
s6586,Movie,Deathgrip,Clay Porter,"Brendan Fairclough, Olly Wilkins, Kyle Jameson, Andrew Neethling, Nico Vink, Ryan Howard, Sam Hill, Josh Bryceland, Brandon Semenuk",United Kingdom,"March 1, 2018",2017,TV-MA,53 min,"International Movies, Sports Movies",Mountain bikers – including legend Brendan Fairclough – put their skills to the test and engage in daring feats set against vivid backdrops.
s6589,Movie,Deewangee,Anees Bazmee,"Ajay Devgn, Akshaye Khanna, Urmila Matondkar, Farida Jalal, Vijayendra Ghatge",India,"January 3, 2020",2002,TV-MA,156 min,"International Movies, Thrillers","Hired by a singer to defend her friend, who has been accused of murder, a formidable lawyer learns that the man he represents may not be innocent."
s6590,Movie,Defying the Nazis: The Sharps' War,"Ken Burns, Artemis Joukowsky","Tom Hanks, Marina Goldman",United States,"May 1, 2017",2016,TV-14,79 min,Documentaries,"This film documents the story of minister Waitstill Sharp and his wife, Martha, who risked everything to save thousands of refugees fleeing the Nazis."
s6591,Movie,Delirium,Dennis Iliadis,"Topher Grace, Genesis Rodriguez, Patricia Clarkson, Callan Mulvey, Robin Thomas, Daisy McCrackin",United States,"September 1, 2018",2018,R,96 min,"Horror Movies, Thrillers",A man with a history of mental issues moves into his late parents' mansion and comes to suspect his new home may be haunted.
s6592,Movie,Democrats,Camilla Nielsson,,"Denmark, Zimbabwe","April 25, 2016",2014,NR,99 min,"Documentaries, International Movies","After Zimbabwe's disputed 2008 election results, political enemies are asked to write a new constitution and save their country from a bleak future."
s6593,Movie,Den of Thieves,Christian Gudegast,"Gerard Butler, Pablo Schreiber, O'Shea Jackson Jr., 50 Cent, Meadow Williams, Maurice Compte, Brian Van Holt, Evan Jones, Mo McRae, Kaiwi Lyman",United States,"May 1, 2020",2018,R,140 min,Action & Adventure,A highly skilled crew of bank robbers plotting a heist at the supposedly impenetrable Federal Reserve faces off against an elite unit of L.A. cops.
s6594,Movie,Denis Leary: No Cure For Cancer,Ted Demme,Denis Leary,United States,"August 8, 2017",1992,R,62 min,Stand-Up Comedy,"In the stand-up performance that made him a legend, comedian Denis Leary caustically holds forth on nonsmokers, vegetarians and other undesirables."
s6595,Movie,Desolate,Frederick Cipoletti,"Will Brittain, Callan Mulvey, Tyson Ritter, Bill Tangradi, Natasha Bassett, James Russo, Jonathan Rosenthal, Juston Street, Mark Kassen, Takuya Iba, Michael Rhys Kan, Jack Conley, Trieu Tran",,"February 6, 2020",2018,TV-MA,88 min,"Dramas, Thrillers","In a severe, drought-ravaged dystopia, the youngest of a farm family starts a quest for revenge after his brothers betray him and leave him for dead."
s6596,Movie,Desolation,Sam Patton,"Jaimi Paige, Alyshia Ochse, Toby Nichols, Claude Duhamel",United States,"May 8, 2018",2017,TV-MA,76 min,"Horror Movies, Thrillers","Along with her son and best friend, a grieving widow hikes into the woods to scatter her late husband's ashes, only to discover they're being stalked."
s6597,Movie,Detention Letter,Mohamed Samy,"Mohamed Ramadan, Dina El-Sherbiny, Eyad Nassar, Sayed Rajab, Walid Fawaz, Eman El-Assy",Egypt,"August 5, 2019",2017,TV-14,99 min,"Action & Adventure, International Movies",A man begins to regret his choices when his brother decides to join him as a member of the same terrorist organization.
s6598,Movie,Detour,Christopher Smith,"Tye Sheridan, Bel Powley, Emory Cohen, Gbenga Akinnagbe, Jared Abrahamson, John Lynch, Stephen Moyer","United Kingdom, South Africa","May 25, 2017",2016,R,97 min,Thrillers,"Convinced his stepfather caused the crash that left his mother in a coma, a law student drunkenly agrees to his murder, then can't rescind the deal."
s6599,Movie,Deviant Love,Michael Feifer,"Emma Bell, Nick Ballard, Bradley Bundlie, Gail O'Grady, Corbin Timbrook, Kate Lang Johnson, Robert Adamson, Caia Coley, Alicia James, Sotida Arpon",United States,"September 13, 2019",2019,TV-14,87 min,Thrillers,"In a tailspin after her marriage collapses, Jamie falls for a helpful gentleman whose interest in her welfare hides sinister motives."
s6600,Movie,Devil's Bride,Saara Cantell,"Tuulia Eloranta, Magnus Krepper, Elin Petersdottir, Claes Malmberg, Kaija Pakarinen, Antti Reini, Lauri Tanskanen, Johanna af Schultén, Maria Sid, Pirkko Hämäläinen, Sonja Halla-aho","Finland, Sweden, Norway, Latvia, Germany","June 1, 2017",2016,TV-MA,108 min,"Dramas, International Movies","On a small Finnish island in 1666, a teenage girl in love with a married fisherman becomes the center of a tragic witch hunt and power struggle."
s6601,Movie,Devil's Gate,Clay Staub,"Amanda Schull, Milo Ventimiglia, Shawn Ashmore, Bridget Regan, Jonathan Frakes, Sarah Constible, Spencer Drever, Javier Botet",Canada,"July 16, 2020",2017,TV-MA,94 min,"Horror Movies, Sci-Fi & Fantasy, Thrillers","Seeking a missing woman in North Dakota, an FBI agent and a sheriff focus on her religious zealot husband but discover something far more sinister."
s6603,Movie,Devrai,"Sumitra Bhave, Sunil Sukthankar","Atul Kulkarni, Sonali Kulkarni, Tushar Dalvi, Devika Daftardar, Amruta Subhash, Mohan Agashe, Ashwin Chitale, Jyoti Subhash",India,"January 1, 2018",2004,TV-PG,123 min,"Dramas, International Movies","After science student Shesh Shahi – a shy eccentric with a strange connection to nature – is examined by a team of mental hospital doctors, a gripping portrait of schizophrenia emerges."
s6605,Movie,Dhamaal,Indra Kumar,"Sanjay Dutt, Riteish Deshmukh, Arshad Warsi, Aashish Chaudhary, Javed Jaffrey, Prem Chopra, Asrani, Tiku Talsania",India,"December 31, 2019",2007,TV-14,128 min,"Action & Adventure, Comedies, International Movies","Tipped off about buried money in Goa, four ne’er-do-well friends go on the hunt, chased by a police officer who wants the treasure for himself."
s6606,Movie,Di Renjie zhi Sidatianwang,Hark Tsui,"Mark Chao, Feng Shaofeng, Kenny Lin, Carina Lau, Ethan Juan, Sandra Ma","China, Hong Kong","February 6, 2019",2018,TV-14,132 min,"Action & Adventure, International Movies, Sci-Fi & Fantasy","Framed by an empress who plans to steal a dragon-taming mace, imperial magistrate Dee Renjie soon uncovers a greater plot that threatens the kingdom."
s6607,Movie,Diana: 7 Days That Shook the World,Ben Ryder,James D'Arcy,United Kingdom,"July 28, 2017",2017,TV-PG,93 min,Documentaries,"This illuminating documentary examines the aftermath of Princess Diana’s tragic death and the tense, dramatic week leading up to her funeral."
s6608,Movie,Diana: In Her Own Words,,,United Kingdom,"December 1, 2017",2017,TV-PG,113 min,"Documentaries, International Movies","Featuring archival footage and personal recordings, this documentary offers candid insight into the life of the beloved princess."
s6609,Movie,Diary of a Chambermaid,Benoît Jacquot,"Léa Seydoux, Vincent Lindon, Clotilde Mollet, Hervé Pierre, Mélodie Valemberg, Patrick d'Assumçao, Vincent Lacoste, Joséphine Derenne, Dominique Reymond","France, Belgium","December 3, 2016",2015,NR,96 min,"Dramas, International Movies","An attractive young woman goes to work as a chambermaid for a troublesome couple. The wife is unreasonable, and the husband won't stop hitting on her."
s6610,Movie,Die Another Day,Lee Tamahori,"Pierce Brosnan, Halle Berry, Toby Stephens, Rick Yune, Rosamund Pike, Judi Dench, John Cleese, Michael Madsen, Will Yun Lee, Kenneth Tsang, Emilio Echevarría, Mikhail Gorevoy, Lawrence Makoare, Colin Salmon, Samantha Bond","United Kingdom, United States","December 31, 2019",2002,PG-13,133 min,Action & Adventure,Pierce Brosnan's final outing as 007 finds James Bond facing off against a North Korean terrorist who's in league with a British diamond merchant.
s6611,Movie,Dil Hai Tumhaara,Kundan Shah,"Rekha, Preity Zinta, Mahima Chaudhry, Arjun Rampal, Jimmy Shergill, Alok Nath, Dilip Joshi, Govind Namdeo",India,"April 1, 2018",2002,TV-14,176 min,"Dramas, International Movies, Music & Musicals","The sophisticated son of a powerful businessman falls for a simple, free-spirited girl whose older sister is in love with him."
